Location,Price_Period,Date_Added_Updated,Description,Serviced,Bed_Bath_Toilet
Igando Ikotun Igando Lagos,"650,000/year","  Updated 26 Dec 2022, Added 03 Aug 2022 "," FOR RENT: To Let........3bedroom flat inside federal peace estate isheri, down stair, .. Read more ",,0 beds0 baths0 Toilets
Off Ashimowu Bakare Street Via Otuoba Bus Stop Itire Lawanson Rd Itire Surulere Lagos,"400,000/year","  Updated 26 Dec 2022, Added 01 Mar 2022 ", FOR RENT: classic Room Selfcon brand new Off Ashimowu Bakare Street via Otuoba Bus Stop it.. Read more ,,0 beds0 baths1 Toilets
Osapa London Lekki Lagos,"92,000,000","  Updated 19 Feb 2023, Added 12 Jan 2023 ", FOR SALE: Newly Built 4 bedroom terrace duplex with a bq Location: Osapa London off Agu.. Read more,Newly Built,4 beds4 baths5 Toilets
"Otedola Estate, Magodo Kosofe Ikosi Lagos","3,500,000/year","  Updated 26 Dec 2022, Added 22 Aug 2022 ", FOR RENT: 5 bedrooms bungalow with 3 bedrooms flat with 2 rooms BQ within otedola estate. .. Read more ,,0 beds0 baths0 Toilets
Celestial Avenue Oke Ira Ogba Lagos,"1,000,000/year","  Updated 26 Dec 2022, Added 21 Dec 2022 ", FOR RENT: House for rent Celestial Avenue Oke-Ira Ogba Lagos.. Read more ,,0 beds0 baths0 Toilets
Chisco Ikate Lekki Lagos,"15,000,000/year","  Updated 26 Dec 2022, Added 17 Jun 2022 ", FOR RENT: For rent Shop & office Space Full building price: 15m Agency 10% .. Read more ,,0 beds0 baths0 Toilets
Ikeja Gra Ikeja Lagos,"12,000,000/year","  Updated 26 Dec 2022, Added 26 Apr 2022 ", FOR RENT: LETTING AT IKEJA GRA: Fully furnished and service luxury flat/ apartments 2.. Read more ,,0 beds0 baths0 Toilets
Victoria Island Lagos,"150,000/sqm","  Updated 26 Dec 2022, Added 06 Oct 2022 ", FOR RENT: Rent Shops space Amount 150k per square meter Sc 20k per square mete.. Read more ,,0 beds0 baths0 Toilets
Ojodu Lagos,"1,000,000/year","  Updated 26 Dec 2022, Added 07 Jul 2022 ", FOR RENT: To let Nice 2bedroom flat all room ensuit ground floor in a close off budland.. Read more ,,0 beds0 baths0 Toilets
Ikosi Ketu Lagos,"1,500,000/year","  Updated 26 Dec 2022, Added 27 Jun 2022 ", FOR RENT: JUST OUT RELATIVELY NEW DECENT AND SPACIOUS 2BEDROOM FLAT WITH ALLROOM ENSUIT.. Read more ,,0 beds0 baths0 Toilets
Adeniyi Jones Ikeja Lagos,"6,000,000/year","  Updated 26 Dec 2022, Added 30 May 2022 ", FOR RENT: To Let 4-bedroom semi-detached duplex with a room bq inside an Estate in off .. Read more ,,0 beds0 baths0 Toilets
Magodo Gra Phase 2 Kosofe Ikosi Lagos,"3,000,000/year","  Updated 26 Dec 2022, Added 28 Jun 2022 ", FOR RENT: JUST OUT DECENT AND STANDARD 3BEDROOM FLAT UPSTAIRS IN A SERENE ENVIRONMEnT O.. Read more ,,0 beds0 baths0 Toilets
Morgan Estate Phase 2 Ojodu Lagos,"700,000","  Updated 26 Dec 2022, Added 29 Apr 2022 ", FOR RENT: To let 2 units of Spacious Miniflat flat with 2toilet & 2bath Location: M.. Read more ,,0 beds0 baths0 Toilets
Victoria Island Lagos,"35,000,000/year","  Updated 26 Dec 2022, Added 17 Nov 2022 ", FOR RENT: For lease... A rooftop space for a lounge Measuring 260sqm in a busy location.. Read more ,, beds baths Toilets
"Shapati, After Lakowe Ibeju Lekki Lagos","16,000/sqm","  Updated 26 Dec 2022, Added 10 Nov 2022 "," FOR RENT: Now Letting Warehouse measuring 1200sqm, 2400sqm and 7200sqm with high-head r.. Read more ",,0 beds0 baths0 Toilets
"Osborne Phase 2, Ikoyi Lagos","10,000,000/year","  Updated 26 Dec 2022, Added 15 Dec 2022 "," FOR RENT: For rent... 5 Bedroom Duplex With A Room BQ For An Office Space, mainly for.. Read more ",,5 beds0 baths0 Toilets
Alapere Ketu Lagos,"700,000/year","  Updated 26 Dec 2022, Added 28 Jun 2022 ", FOR RENT: JUST OUT A newly built and tastefully finished miniflat with all modern facil.. Read more ,,0 beds0 baths0 Toilets
Ikotun Igando Lagos,"5,500,000/year","  Updated 26 Dec 2022, Added 14 Jul 2022 "," FOR RENT: Station along isheri igando Road, by isheri. 5.5m x 5yrs.. Read more ",,0 beds0 baths0 Toilets
Lekki Phase 1 Lekki Lagos,"10,000,000/year","  Updated 26 Dec 2022, Added 19 Jul 2022 "," FOR RENT: URGENT TO LET IN LEKKI PHASE1, IT WON'T STAY LONG IN MARKET 5bedrooms Fully.. Read more ",,0 beds0 baths0 Toilets
Idado Lekki Lagos,"6,500,000/year","  Updated 26 Dec 2022, Added 20 Oct 2022 ", FOR RENT: 4-Bedroom Semi Detached Duplex With A Bq Rent: 6.5Million Agency: 10% .. Read more ,,0 beds0 baths0 Toilets
Ilasan Lekki Lagos,"1,300,000/year","  Updated 26 Dec 2022, Added 10 Aug 2022 ", FOR RENT: Rent Shared Apartment Amount 1.3m Service charge 200k Caution 10.. Read more ,,0 beds0 baths0 Toilets
Ojodu Lagos,"800,000/year","  Updated 26 Dec 2022, Added 19 Jul 2022 ", FOR RENT: To let Renovated House 2 units of 2bedroom flat all room ensuit with p.o.p .. Read more ,,0 beds0 baths0 Toilets
Adeniyi Jones Ikeja Lagos,"145,000,000","  Updated 19 Feb 2023, Added 07 Oct 2022 ", FOR SALE: Brand new 4 bedroom semi-detached duplex in Adeniyi Jones Ikeja price is 145m .. Read more,Newly Built,4 beds4 baths4 Toilets
"Lekki Right, Close To Pinnacle Filling Station Lekki Phase 1 Lekki Lagos","20,000,000/year","  Updated 26 Dec 2022, Added 22 Nov 2022 "," FOR RENT: For rent... A land property Measuring 1,400sqm minimum 3years. Rent: N20m.. Read more ",, beds baths Toilets
Lekki Phase 1 Lekki Lagos,"5,000,000/year","  Updated 26 Dec 2022, Added 15 Jun 2022 ", FOR RENT: JUST OUT BRAND NEW 2 UNITS OF 2 BEDROOM FLAT at 5 Million each per annum. One.. Read more ,,0 beds0 baths0 Toilets
Lekki Phase 1 Lekki Lagos,"30,000,000/year","  Updated 26 Dec 2022, Added 19 Jul 2022 ", FOR RENT: Lease Fully furnished 2 units of 3 bedroom maisonette and 1 unit of 2 bedroo.. Read more ,,0 beds0 baths0 Toilets
Magodo Gra Phase 2 Kosofe Ikosi Lagos,"2,800,000/year","  Updated 26 Dec 2022, Added 27 Jun 2022 "," FOR RENT: UNDER RENOVATION 3BEDROOM FLAT WITH ALL ROOM ENSUITE, WATER HEATER, POP CEILING,.. Read more ",,0 beds0 baths0 Toilets
Magodo Gra Phase 2 Kosofe Ikosi Lagos,"12,000,000/year","  Updated 26 Dec 2022, Added 27 Jul 2022 ", FOR RENT: 8-bedroom Detached Duplex with BQ Rent: N12m .. Read more ,,0 beds0 baths0 Toilets
Victoria Island Lagos,"150,000/sqm","  Updated 26 Dec 2022, Added 04 Nov 2022 ", FOR RENT: For Rent.. Newly built Shop space in a Serene and busy Environment Size:52.. Read more ,Newly Built,0 beds0 baths0 Toilets
Allen Avenue Ikeja Lagos,"5,000,000","  Updated 26 Dec 2022, Added 12 May 2022 ", FOR RENT: TO LET Fully Serviced 3Bedroom Apartment + B.Q + Gym + Swimming pool. Rent: .. Read more ,,0 beds0 baths0 Toilets
Victoria Island Lagos,"100,000/sqm","  Updated 26 Dec 2022, Added 04 Nov 2022 "," FOR RENT: For Rent.. A commerical business centre for rent in Victoria island,lago.. Read more ",Newly Built,0 beds0 baths0 Toilets
Moyo Agoro Street Ogba Bus Stop Ogba Lagos,"800,000/year","  Updated 26 Dec 2022, Added 30 Sep 2022 ", FOR RENT: House for rent Moyo Agoro Street Ogba Bus-stop Ogba Lagos.. Read more ,,0 beds0 baths0 Toilets
Ajah Lagos,"5,000,000/year","  Updated 26 Dec 2022, Added 18 Oct 2022 ", FOR RENT: 4-Bedroom Fully Detached Duplex Rent: 5 Million Agency: 10% Legal: 10%.. Read more ,,0 beds0 baths0 Toilets
Ikeja Lagos,"10,000,000/year","  Updated 26 Dec 2022, Added 26 Jul 2022 ", FOR RENT: TO LET WELL FINISHED 6 BEDROOM DETACHED HOUSE ALL ROOMS ENSUI.. Read more ,,0 beds0 baths0 Toilets
Allen Avenue Ikeja Lagos,"6,000,000","  Updated 26 Dec 2022, Added 09 May 2022 ", FOR RENT: JUST OUT Newly Built Executive 4 Bedroom Terrace Duplex for rent in a secured .. Read more ,,0 beds0 baths0 Toilets
Lekki Phase 1 Lekki Lagos,"4,000,000/year","  Updated 26 Dec 2022, Added 15 Jun 2022 ", FOR RENT: This is the breakdown: 3 bed for rent Rent N4m. Service Charge N3.5m. Ref.. Read more ,,0 beds0 baths0 Toilets
Victoria Island Lagos,"60,000/sqm","  Updated 26 Dec 2022, Added 01 Dec 2022 ", FOR RENT: For rent... 2 wings of office space in a busy location each wing 160sqm. P.. Read more ,,0 beds0 baths0 Toilets
Ikosi Ketu Lagos,"2,000,000/year","  Updated 26 Dec 2022, Added 27 Jun 2022 ", FOR RENT: Hot & Fresh 2 bedroom and 3 bedroom downstairs and upstairs respectively availa.. Read more ,,0 beds0 baths0 Toilets
Kosofe Ikosi Lagos,"2,000,000/year","  Updated 26 Dec 2022, Added 28 Jun 2022 ", FOR RENT: NEWLY BUILT 2BEDROOM DUPLEX APARTMENT WITH OWN COMPOUND IS AN ESTATE IN OLOWORA .. Read more ,,0 beds0 baths0 Toilets
Shomolu Lagos,"1,000,000/year","  Updated 26 Dec 2022, Added 25 May 2022 "," FOR RENT: TO-LET Newly built luxury Mini flat with two toilets, pop, kitchen cabinet an.. Read more ",,0 beds0 baths0 Toilets
Awolowo Way Ikeja Lagos,"4,000,000/year","  Updated 26 Dec 2022, Added 04 Jul 2022 "," FOR RENT: TO LET 4 bedroom flat, With a Room Bq FURNISHED Good For Lounge Self C.. Read more ",,0 beds0 baths0 Toilets
Idimu Egbe Idimu Lagos,"600,000/year","  Updated 26 Dec 2022, Added 17 Aug 2022 ", FOR RENT: Standard 2 bedroom apartment to let Facilities includes: Prepaid meter Runnin.. Read more ,,0 beds0 baths0 Toilets
"Akora Estate, Adeniyi Jones Ikeja Lagos","3,500,000/year","  Updated 26 Dec 2022, Added 02 Sep 2022 "," FOR RENT: To Let: 3- Bedroom flat, all room ensuite at Daratuns court, Orimolade estat.. Read more ",,0 beds0 baths0 Toilets
Ifako Gbagada Gbagada Lagos,"1,200,000/year","  Updated 26 Dec 2022, Added 06 May 2022 ", FOR RENT: LONG LEASE INVESTMENT A Tastefully finished mini flat's with pop finishing fitte.. Read more ,,0 beds0 baths0 Toilets
Adeniyi Jones Ikeja Lagos,"2,500,000","  Updated 26 Dec 2022, Added 26 Jul 2022 "," FOR RENT: TO LET Eight blocks of two bedroom and three bedroom flat in an mini estate,.. Read more ",,0 beds0 baths0 Toilets
Opebi Road Opebi Ikeja Lagos,"30,000,000/year","  Updated 26 Dec 2022, Added 21 Dec 2022 ", FOR RENT: Commercial Property for rent Opebi Road Opebi Ikeja Lagos.. Read more ,,0 beds0 baths0 Toilets
Magodo Gra Phase 2 Kosofe Ikosi Lagos,"2,500,000/year","  Updated 26 Dec 2022, Added 27 Jun 2022 ", FOR RENT: JUST OUT SHARP AND STANDARD 2BEDROOM FLAT IN A SERENE ENVIRONMENT OF MAGODO P.. Read more ,,0 beds0 baths0 Toilets
Magodo Gra Phase 2 Kosofe Ikosi Lagos,"1,500,000/year","  Updated 26 Dec 2022, Added 27 Jun 2022 ", FOR RENT: JUST OUT CHEAPEST AND STANDARD 2-BEDROOM FLAT IN A SERENE ENVIRONMENT OF MAGO.. Read more ,,0 beds0 baths0 Toilets
Thomas Estate Ajah Lagos,"1,200,000/year","  Updated 26 Dec 2022, Added 08 Nov 2022 ", FOR RENT: For Rent.. A Shop space for rent in thomas Estate. 1.2m per annum.. Agenc.. Read more ,, beds baths Toilets
"Alade Close, Ikeja Lagos","6,000,000","  Updated 26 Dec 2022, Added 29 Aug 2022 ", FOR RENT: A fully detached house with bq at Alade Close with good parking space for either.. Read more ,,0 beds0 baths0 Toilets
Off Funso Owoyemi Hammadiya Abule Egba Lagos,"800,000","  Updated 26 Dec 2022, Added 29 Apr 2022 ", FOR RENT: To let 3 bedrooms with pop and 3 toilets all-round Ties with big compound f.. Read more ,,0 beds0 baths0 Toilets
Marina Lagos Island Lagos,"20,000/sqm","  Updated 26 Dec 2022, Added 22 Jul 2022 "," FOR RENT: For Rent Description: Open plan office Space on 4th, 7th and 9th Floor havi.. Read more ",, beds baths Toilets
Lekki Phase 1 Lekki Lagos,"6,000,000/year","  Updated 26 Dec 2022, Added 04 Jul 2022 "," FOR RENT: TO LET Newly built 4 Units of 3Bedroom Terrace with a BQ, Fridge , Microwave .. Read more ",,0 beds0 baths0 Toilets
Oregun Ikeja Lagos,"6,000,000/year","  Updated 26 Dec 2022, Added 29 Jun 2022 "," FOR RENT: TO LET/LEASE: A WAREHOUSE FACILITY MEASURING 4,500 SQFT IDEAL FOR BAKERY, C.. Read more ",,0 beds0 baths0 Toilets
Off Toyin Street Ikeja Lagos,"1,000,000/year","  Updated 26 Dec 2022, Added 01 Jul 2022 ", FOR RENT: JUST OUT MINI FLAT For Residential Use Location = Serene Environment at O.. Read more ,,0 beds0 baths0 Toilets
Toyin Street Ikeja Lagos,"80,000/sqm","  Updated 26 Dec 2022, Added 15 Dec 2022 ", FOR RENT: For rent... Newly built open-plan office space. Size: 305sqm Location:.. Read more ,,0 beds0 baths0 Toilets
Osapa London Lekki Lagos,"5,500,000/year","  Updated 26 Dec 2022, Added 23 Dec 2022 ", FOR RENT: For rent... 5 Bedroom Fully Detached House. Rent: 5.5m Service Charge.. Read more ,,5 beds0 baths0 Toilets
"Arowojobe Estate , Maryland Lagos","5,000,000/year","  Updated 26 Dec 2022, Added 19 Jul 2022 ", FOR RENT: To let newly built 4bedroom terrace duplex with BQ at Arowojobe estate Mary land.. Read more ,,0 beds0 baths0 Toilets
"Osborne Phase 2, Osborne Foreshore Estate Ikoyi Lagos","17,000,000/year","  Updated 26 Dec 2022, Added 15 Dec 2022 ", FOR RENT: For rent... Neatly Built 4 Bedroom Terrace Duplex With a Room BQ. Located.. Read more ,Newly Built,4 beds0 baths0 Toilets
Ojodu Lagos,"1,500,000/year","  Updated 26 Dec 2022, Added 01 Jul 2022 ", FOR RENT: To let Lovely 3bedroom flat all rooms ensuite pop finished off grammar school.. Read more ,,0 beds0 baths0 Toilets
Salem Lekki Lagos,"1,700,000/year","  Updated 26 Dec 2022, Added 11 Oct 2022 ", FOR RENT: Rent Mini flat Rent: 1.7m Agent 10% Legal 10% Caution 200k S.. Read more ,,0 beds0 baths0 Toilets
Ogudu Gra Ogudu Lagos,"5,000,000/year","  Updated 26 Dec 2022, Added 29 Jun 2022 ", FOR RENT: Newly built 4 bedroom terace duplex with bq Price 5m At ogudu GRA lagos Balc.. Read more ,,0 beds0 baths0 Toilets
Sunview Estate Sangotedo Ajah Lagos,"2,500,000/year","  Updated 26 Dec 2022, Added 14 Dec 2022 ", FOR RENT: For rent: Neatly finished 4 Bedroom Detached House in a good location All .. Read more ,,4 beds0 baths0 Toilets
Magodo Gra Phase 2 Kosofe/ikosi Lagos,"158,000,000","  Updated 19 Feb 2023, Added 19 Sep 2022 ", FOR SALE: TASTEFULLY FINISHED 5 BEDROOM FULLY DETACHED DUPLEX I IN A COZY ESTATE MAGOD.. Read more,,0 beds0 baths0 Toilets
Ogudu Lagos,"1,500,000/year","  Updated 26 Dec 2022, Added 29 Aug 2022 ", FOR RENT: Lovely newly built 2bedroom flat upstairs 2toilet 2bathroom a room ensuite with .. Read more ,,0 beds0 baths0 Toilets
Omole Phase 2 Ojodu Lagos,"4,500,000/year","  Updated 26 Dec 2022, Added 27 Jun 2022 "," FOR RENT: TO LET Relatively New 4bedroom duplex with all room ensuite, water heater, .. Read more ",,0 beds0 baths0 Toilets
Lekki Phase 1 Lekki Lagos,"100,000","  Updated 26 Dec 2022, Added 23 Oct 2022 "," FOR RENT: Rent is N100,000 per Square meter Agency: 10% Legal: 10% Caution: .. Read more ",, beds baths Toilets
Lekki Conservative Lekki Lagos,"3,000,000/year","  Updated 26 Dec 2022, Added 12 Oct 2022 ", FOR RENT: 3 Bedroom Apartment Location: Lekki Conservative Rent: 3 Million Agen.. Read more ,, beds baths Toilets
Oke Ira Ogba Lagos,"2,300,000/year","  Updated 26 Dec 2022, Added 29 Jun 2022 ", FOR RENT: A Newly Renovated 3 Bedroom Flat Bungalow Self Compound (All rooms en-suite) P.O.. Read more ,,0 beds0 baths0 Toilets
Salem Lekki Lagos,"3,000,000","  Updated 26 Dec 2022, Added 19 Jul 2022 ", FOR RENT: Rent Mini flat Fully Furnished Rent:3m - Fully furnished with furnitu.. Read more ,, beds baths Toilets
Ojodu Aina Street Off Grammar School. Berger Ojodu Lagos,"500,000/year","  Updated 26 Dec 2022, Added 12 Jun 2022 ", FOR RENT: To let Sharp finger Standard Shop with toilet on Aina street Ojodu Rent: .. Read more ,,0 beds0 baths1 Toilets
Ojodu Berger Obafalabi. Berger Ojodu Lagos,"600,000/year","  Updated 26 Dec 2022, Added 22 Jun 2022 ", FOR RENT: To let shop at ojodu Berger obafalabi street with toilets price 600k. (Agt ye.. Read more ,,0 beds0 baths1 Toilets
Off College Road Ogba Lagos,"2,200,000/year","  Updated 26 Dec 2022, Added 07 Jul 2022 "," FOR RENT: Beautiful & Unique 6 numbers of 3 Bedrooms, all Rooms Ensuit with Water Heater, .. Read more ",,0 beds0 baths0 Toilets
Ikate Lekki Lagos,"7,000,000/year","  Updated 26 Dec 2022, Added 20 Oct 2022 ", FOR RENT: 3-Bedroom Furnished Apartment with a bq Rent: 7Million Agency: 10% Leg.. Read more ,,0 beds0 baths0 Toilets
Ganiyat Daudu Street Ifako Gbagada Gbagada Lagos,"3,500,000/year","  Updated 26 Dec 2022, Added 27 May 2022 "," FOR RENT: TO LET Direct brief Newly built 3bedroom duplex with a room BQ, fitted kitche.. Read more ",,0 beds0 baths0 Toilets
Ikate Lekki Lagos,"5,500,000/year","  Updated 26 Dec 2022, Added 12 Oct 2022 ", FOR RENT: 4 Bedroom Terrace Duplex Location: Ikate Rent: 5.5Million Agency: 10%.. Read more ,,0 beds0 baths0 Toilets
Victory Estate Ojodu Lagos,"200,000/year","  Updated 26 Dec 2022, Added 26 Apr 2022 "," FOR RENT: A Room self contain at Victory estate, Ojodu Rent: 200k per annum Total p.. Read more ",,0 beds0 baths0 Toilets
Magodo Gra Phase 1 Ojodu Lagos,"5,000,000/year","  Updated 26 Dec 2022, Added 29 Jun 2022 "," FOR RENT: To Let semi direct Brief: 5bedroom detached duplex wth bq security house, pop,al.. Read more ",,0 beds0 baths0 Toilets
Banana Island Ikoyi Lagos,"15,000,000/year","  Updated 26 Dec 2022, Added 13 Dec 2022 ", FOR RENT: For rent... Exquisite and spacious 4Bedrooms Terrace Duplex all ensuite Terra.. Read more ,,4 beds0 baths0 Toilets
Ikate Lekki Lagos,"5,000,000/year","  Updated 26 Dec 2022, Added 18 Oct 2022 ", FOR RENT: 4 Bedroom Maisonette Location: Ikate Rent: 5Million Agency: 10% L.. Read more ,,0 beds0 baths0 Toilets
"Kay Farm, Obawole, Iju Lagos","1,500,000","  Updated 26 Dec 2022, Added 26 Jul 2022 "," FOR RENT: TO LET 3 bedroom flat in a block of 4 at Kay Farm, Obawole 2t/2b) ground floo.. Read more ",,0 beds0 baths0 Toilets
Kings Avenue Berger Ojodu Lagos,"900,000/year","  Updated 26 Dec 2022, Added 26 Apr 2022 ", FOR RENT: To let a newly renovated 2bedroom flat all rooms ensuit with tasteful finishe.. Read more ,,0 beds0 baths0 Toilets
Orchid Lekki Lagos,"5,500,000/year","  Updated 26 Dec 2022, Added 18 Oct 2022 ", FOR RENT: 4 Bedroom Terrace Duplex Location: Orchid Rent: 5.5Million Agency: 10.. Read more ,,0 beds0 baths0 Toilets
Alapere Ketu Lagos,"600,000/year","  Updated 26 Dec 2022, Added 28 Jun 2022 "," FOR RENT: DIRECT: Still available A newly renovated lovely spacious miniflat, screened .. Read more ",,0 beds0 baths0 Toilets
Adeniyi Jones Ikeja Lagos,"100,000,000","  Updated 19 Feb 2023, Added 21 Sep 2022 ", FOR SALE: BRAND NEW 4 BEDROOM TERRACE DUPLEX FOR SALE. Amenities: - Fitted Kitchen w.. Read more,,4 beds4 baths4 Toilets
Ikate Lekki Lagos,"900,000/year","  Updated 26 Dec 2022, Added 13 Jul 2022 ", FOR RENT: Rent Self contain Rent 900k Legal 10% Agent 10% Features Fitted k.. Read more ,,0 beds0 baths0 Toilets
Off Adeniyi Jones Adeniyi Jones Ikeja Lagos,"6,500,000/year","  Updated 26 Dec 2022, Added 21 Dec 2022 ", FOR RENT: For rent... Semi-Detached House on a Corner Piece. Located: Off Adeniyi J.. Read more ,,4 beds0 baths0 Toilets
Ogba Gra Ogba Lagos,"3,500,000/year","  Updated 26 Dec 2022, Added 01 Aug 2022 "," FOR RENT: Massive and spacious five bedroom duplex with mini flat bq ,massive compound of.. Read more ",,0 beds0 baths0 Toilets
Ikosi Ketu Lagos,"1,400,000/year","  Updated 26 Dec 2022, Added 06 Jul 2022 ", FOR RENT: TO LET AT IKOSI OFF ALADEOLA Lagos Tasteful 3bedroom flat All rooms ensuit.. Read more ,,0 beds0 baths0 Toilets
Ikeja Gra Ikeja Lagos,"4,000,000/year","  Updated 26 Dec 2022, Added 06 May 2022 "," FOR RENT: Description:6 nos of 3 Bedroom Flat with Bq Location: Ikeja Gra, Lagos Ren.. Read more ",,0 beds0 baths0 Toilets
Osapa London Lekki Lagos,"5,000,000/year","  Updated 26 Dec 2022, Added 13 Dec 2022 ", FOR RENT: 4-bedroom semi-detached duplex plus bq and security house. Location - green.. Read more ,Newly Built,4 beds4 baths5 Toilets
Ikosi Ketu Lagos,"1,700,000/year","  Updated 26 Dec 2022, Added 27 Jun 2022 ", FOR RENT: BRAND NEW AND TASTEFULLY MODERN APPURTENANCES BUILT 2BEDROOM FLAT WITH FULLY FIT.. Read more ,,0 beds0 baths0 Toilets
Magodo Gra Phase 1 Ojodu Lagos,"2,000,000/year","  Updated 26 Dec 2022, Added 01 Jul 2022 ", FOR RENT: EXCLUSIVE 3BED ROOM FLAT ALL ENSUITE WITH VISITORS TOILET UP STAIRS ON AYODELE F.. Read more ,,0 beds0 baths0 Toilets
Lekki Phase 1 Lekki Lagos,"4,000,000/year","  Updated 26 Dec 2022, Added 01 Nov 2022 ", FOR RENT: For Rent Newly Built And Well Finished 2 Bedroom Flat - Good finishing - .. Read more ,Newly Built,0 beds0 baths0 Toilets
Ojodu Lagos,"5,000,000/year","  Updated 26 Dec 2022, Added 26 Jul 2022 ", FOR RENT: For lease A very spacious car wash space with a large ground floor on a busy.. Read more ,,0 beds0 baths0 Toilets
Lekki Phase 1 Lekki Lagos,"3,500,000/year","  Updated 26 Dec 2022, Added 27 Jul 2022 ", FOR RENT: Lekki phase 1 7 blocks of One(1) bedroom apartment and 3 Units of two(2) bed.. Read more ,,0 beds0 baths0 Toilets
Ogombo Road Ogombo Ajah Lagos,"4,000,000/year","  Updated 26 Dec 2022, Added 28 Sep 2022 "," FOR RENT: For Rent 2 plots of fenced and gated Land Suitable for warehouse, Car was.. Read more ",, beds baths Toilets
Orchid Road Lekki Lagos,"3,000,000/year","  Updated 26 Dec 2022, Added 24 Nov 2022 ", FOR RENT: For rent.... A shop and office space of 40sqm each in a ground floor and top.. Read more ,,0 beds0 baths0 Toilets
Lekki Lagos,"2,500,000/year","  Updated 26 Dec 2022, Added 23 Jun 2022 ", FOR RENT: For rent Shop space Rent 2.5 Square meter 30 Sc: self-serviced .. Read more ,,0 beds0 baths0 Toilets
Ikorodu Lagos,"2,500,000/year","  Updated 26 Dec 2022, Added 14 Jul 2022 ", FOR RENT: A Filling Station on an Acre of Land for Lease at IKORODU. 1) Minimum Tenor 3 .. Read more ,,0 beds0 baths0 Toilets
Victoria Island Lagos,"60,000/sqm","  Updated 26 Dec 2022, Added 02 Nov 2022 "," FOR RENT: For Rent 6 units of office Space at VI Lagos, upstairs and ground floor.. .. Read more ",,0 beds0 baths0 Toilets
Dopemu Agege Lagos,"8,000,000/year","  Updated 26 Dec 2022, Added 14 Jul 2022 ", FOR RENT: filling Station along Dopemu agege Road. 8m x 7years. .. Read more ,,0 beds0 baths0 Toilets
Idowu Taylor Victoria Island Lagos,"40,000,000/year","  Updated 26 Dec 2022, Added 10 Nov 2022 "," FOR RENT: For lease.. Bareland for lease. Idowu Taylor, VI Lagos Size:1400sqm Pri.. Read more ",, beds baths Toilets
Ilasan Lekki Lagos,"1,600,000/year","  Updated 26 Dec 2022, Added 23 Aug 2022 "," FOR RENT: Rent 1 & 2 bedroom flat 1 bedroom 1.6m 1.9, 2m Sc 300k Caution 1.. Read more ",,0 beds0 baths0 Toilets
Off Adeola Odeku Adeola Odeku Victoria Island Lagos,"75,000/sqm","  Updated 26 Dec 2022, Added 17 Nov 2022 "," FOR RENT: For rent... An office space Measuring 800sqm on the Ground Floor is 75,000 p.. Read more ",, beds baths Toilets
Ikota Lekki Lagos,"210,000,000","  Updated 19 Feb 2023, Added 19 Dec 2022 ", FOR SALE: Exquisitely built 5 bedroom fully detached duplex in a secured and habitable es.. Read more,Newly Built,5 beds5 baths6 Toilets
Agungi Lekki Lagos,"3,000,000/year","  Updated 26 Dec 2022, Added 12 Oct 2022 ", FOR RENT: 2 Bedroom Apartment Location: Agungi Rent: 3Million Agency: 10% Leg.. Read more ,,0 beds0 baths0 Toilets
Toyin Street Ikeja Lagos,"6,000,000/year","  Updated 26 Dec 2022, Added 02 Jun 2022 "," FOR RENT: Open Plan Office Space with an ample parking space for letting at Toyin street,i.. Read more ",,0 beds0 baths0 Toilets
Omole Phase 1 Ojodu Lagos,"4,600,000/year","  Updated 26 Dec 2022, Added 30 May 2022 ", FOR RENT: A NEW 4 BEDROOM TERRACE DUPLEX WITH BQ IN OMOLE PHASE1 ESTATE FOR N 4.6 MILLION .. Read more ,,0 beds0 baths0 Toilets
Oregun Ikeja Lagos,"25,000,000/year","  Updated 26 Dec 2022, Added 27 Apr 2022 "," FOR RENT: 12units of mini flat, Furnished with basement and lounge for leasing at oregun g.. Read more ",,0 beds0 baths0 Toilets
Victoria Island Lagos,"150,000/sqm","  Updated 26 Dec 2022, Added 04 Nov 2022 "," FOR RENT: For Rent.. Neatly built Shop space for rent, One facing the roadside. Firs.. Read more ",Newly Built,0 beds0 baths0 Toilets
Opebi Ikeja Lagos,"2,500,000/year","  Updated 26 Dec 2022, Added 23 Nov 2022 ", FOR RENT: Commercial Property for rent Opposite Adebola House Opebi Ikeja Lagos.. Read more ,,0 beds0 baths0 Toilets
"Oladele Street, From Yaya Abatan Street, Ogba Lagos","1,200,000/year","  Updated 26 Dec 2022, Added 09 May 2022 "," FOR RENT: NOW LETTING Brand New 6 numberrs of 2 bedroom flat,all rooms ensuite,P.O.P fini.. Read more ",,0 beds0 baths0 Toilets
Off Adeola Odeku Adeola Odeku Victoria Island Lagos,"65,000/sqm","  Updated 26 Dec 2022, Added 17 Nov 2022 "," FOR RENT: For rent.. An office space Measuring 800sqm on the 1st Floor is 65,000per sqm.. Read more ",, beds baths Toilets
Phase 1 Gbagada Lagos,"4,500,000/year","  Updated 26 Dec 2022, Added 18 May 2022 ", FOR RENT: NEW UPDATE @ GBAGADA PHASE1 IN A VERY ENVIRONMENT FURNISHED 4BEDROOM DUPLEX.. Read more ,,0 beds0 baths0 Toilets
Osborne Phase 1 Osborne Foreshore Estate Ikoyi Lagos,"13,000,000/year","  Updated 26 Dec 2022, Added 11 Nov 2022 ", FOR RENT: NOW LEASING 3 Bedroom semi-detached house with 1-room boys' quarter. Loca.. Read more ,Newly Built, beds baths Toilets
Eif Lekki Lekki Lagos,"1,500,000/year","  Updated 26 Dec 2022, Added 16 Sep 2022 ", FOR RENT: Rent Mini flat Amount 1.5m Sc 500k covers electricity Agency 10% .. Read more ,,0 beds0 baths0 Toilets
Omole Phase 2 Ojodu Lagos,"1,500,000/year","  Updated 26 Dec 2022, Added 28 Jun 2022 ", FOR RENT: JUST OUT 2BEDROOM FLAT AT OMOLE PHASE2 IN A GATED AND LOVELY LOCATION RENT 1... Read more ,,0 beds0 baths0 Toilets
Ogba Bus Stop Ogba Lagos,"3,000,000/year","  Updated 26 Dec 2022, Added 24 May 2022 "," FOR RENT: Big Pharmacy Space of 200sqms with 3 rooms office space, and 3 toilets (on a maj.. Read more ",,0 beds0 baths0 Toilets
Adeniyi Jones Ikeja Lagos,"10,000,000/year","  Updated 26 Dec 2022, Added 26 Jul 2022 ", FOR RENT: LETTING Fully furnished 3 bedroom apartment with swimming pool in a very secur.. Read more ,,0 beds0 baths0 Toilets
Oke Ira Ogba Lagos,"1,300,000/year","  Updated 26 Dec 2022, Added 19 Jul 2022 ", FOR RENT: Just out for rent newly build 2bed in okeira second junction P.o.p finished all .. Read more ,,0 beds0 baths0 Toilets
"Off Ayo Alabi Street, Oke Ira Ogba Lagos","1,500,000/year","  Updated 26 Dec 2022, Added 24 May 2022 "," FOR RENT: To-Let: 6 numbers of Newly Built 3Bedroom flats,1 2bedroom flat, and a room self.. Read more ",,0 beds0 baths0 Toilets
