Location,Price_Period,Date_Added_Updated,Description,Serviced,Bed_Bath_Toilet
Agungi Lekki Lagos,"4,000,000/year","  Updated 30 Jan 2023, Added 23 Jan 2023 ", FOR RENT: Units of 3 bedroom Semi detached building. Location- Agungi Rent - N4 m.. Read more ,Newly Built,3 beds3 baths4 Toilets
Lekki Phase 1 Lekki Lagos,"8,000,000/year","  Updated 30 Jan 2023, Added 23 Jan 2023 ", FOR RENT: Property Description For Rent !!! Service 4 Bedroom Terrace Duplex With BQ For.. Read more ,ServicedNewly Built,4 beds4 baths5 Toilets
Lekki Phase 1 Lekki Lagos,"11,000,000/year","  Updated 30 Jan 2023, Added 11 Dec 2022 ", FOR RENT: To let A very spacious newly built 5bedroom detached duplex Annual Rent: .. Read more ,Newly Built,5 beds5 baths6 Toilets
Lekki Lagos,"14,000,000/year","  Updated 30 Jan 2023, Added 24 Jan 2023 "," FOR RENT: 3 bedroom flat with Swimming pool, Gymnasium and a lounge Location Lekki Phase.. Read more ",ServicedNewly Built,3 beds3 baths4 Toilets
Osapa London Lekki Lagos,"2,800,000/year","  Updated 30 Jan 2023, Added 25 Jan 2023 "," FOR RENT: 2 units of 2 bedroom flat Location Osapa London, lekki Lagos State Annual.. Read more ",ServicedNewly Built,2 beds2 baths3 Toilets
"Chisco, Beside House On The Rock Ikate Lekki Lagos","5,500,000/year","  Updated 30 Jan 2023, Added 23 Dec 2022 "," FOR RENT: To let 4 Bedroom Terrace , beside House On the rock, Chisco, Lekki Lagos .. Read more ",ServicedNewly Built,4 beds4 baths5 Toilets
Osborne Foreshore Estate Ikoyi Lagos,"20,000,000/year","  Updated 30 Jan 2023, Added 17 Dec 2022 ", FOR RENT: SELF SERVICED 4 BEDROOM SEMI DETACHED DUPLEX WITH 2 ROOM BQ AND A GATE HOUSE (SE.. Read more ,Newly Built,4 beds4 baths5 Toilets
Ikota Gra Ikota Lekki Lagos,"4,000,000/year","  Updated 30 Jan 2023, Added 12 Dec 2022 ", FOR RENT: 4 bedroom terrace duplex. Well-secured estate with 24 hours electricity Annu.. Read more ,ServicedNewly Built,4 beds4 baths5 Toilets
Banana Island Ikoyi Lagos,"15,000,000/year","  Updated 30 Jan 2023, Added 22 Dec 2022 ", FOR RENT: TO-LET: 4-BEDROOM TERRACE DUPLEX Exquisite and spacious 4Bedrooms all ensui.. Read more ,ServicedNewly Built,4 beds4 baths5 Toilets
Osapa London Lekki Lagos,"9,000,000/year","  Updated 30 Jan 2023, Added 11 Jan 2023 ", FOR RENT: FOR RENT (TWO UNITS) FURNISHED 4 BEDROOM SEMI-DETACHED HOUSE WITH BQ Locati.. Read more ,FurnishedNewly Built,4 beds4 baths5 Toilets
Abacha Estate Ikoyi Lagos,"15,000,000/year","  Updated 30 Jan 2023, Added 22 Dec 2022 "," FOR RENT: TOLET: *5BEDROOM SEMI-DETACHED DUPLEX AT ABACHA ESTATE, IKOYI* An exquiste an.. Read more ",ServicedNewly Built,5 beds5 baths6 Toilets
Oniru Victoria Island Lagos,"12,000,000/year","  Updated 30 Jan 2023, Added 03 Jan 2023 "," FOR RENT: A very spacious and well equipped 4 bedroom semi-detached duplex with a room BQ,.. Read more ",ServicedNewly Built,4 beds4 baths5 Toilets
Osapa London Lekki Lagos,"7,000,000/year","  Updated 30 Jan 2023, Added 25 Jan 2023 ", FOR RENT: 4 Bedroom Terrace Duplex with BQ Location : Osapa London Annual Rent: 7m .. Read more ,ServicedNewly Built,4 beds4 baths5 Toilets
Lekki Phase 1 Lekki Lagos,"5,000,000/year","  Updated 30 Jan 2023, Added 10 Jan 2023 "," FOR RENT: To Let, 3 bedroom Maisonette Location Lekki Phase 1 Annual Rent: 5M .. Read more ",Newly Built,3 beds3 baths4 Toilets
Ologolo Lekki Lagos,"5,000,000/year","  Updated 30 Jan 2023, Added 15 Dec 2022 ", FOR RENT: 5 bedroom fully detached at SPG off ologolo road Annual Rent: N5m .. Read more ,Newly Built,5 beds5 baths6 Toilets
Ologolo Lekki Lagos,"2,500,000/year","  Updated 30 Jan 2023, Added 21 Jan 2023 "," FOR RENT: 2 bed apartment downstairs Location Ologolo, LEKKI Lagos State Rent(2.. Read more ",Newly Built,2 beds2 baths3 Toilets
Osapa London Lekki Lagos,"2,800,000/year","  Updated 30 Jan 2023, Added 25 Jan 2023 "," FOR RENT: 2 units of 2 bedroom flat Location Osapa London, Lekki Lagos State Annual.. Read more ",,2 beds2 baths3 Toilets
Lekki Phase 1 Lekki Lagos,"6,500,000/year","  Updated 30 Jan 2023, Added 09 Jan 2023 "," FOR RENT: 4 Bedroom Terrace Duplex with BQ, swimming pool, and a Gymnasium Annual Rent.. Read more ",Newly Built,4 beds4 baths5 Toilets
Banana Island Ikoyi Lagos,"14,000,000/year","  Updated 30 Jan 2023, Added 24 Jan 2023 "," FOR RENT: LUXURIOUSLY BUILT 3 BEDROOM FLAT WITH BQ COMES WITH SWIMMING POOL, GYM,ELEV.. Read more ",Newly Built,3 beds3 baths4 Toilets
Ikoyi Lagos,"30,000,000/year","  Updated 30 Jan 2023, Added 22 Dec 2022 "," FOR RENT: 5 BEDROOM MAISONETTE FOR RENT!!! Annual Rent: 30m, per annum ( 2 years upfro.. Read more ",ServicedNewly Built,5 beds5 baths6 Toilets
Orchid Road Ikota Lekki Lagos,"4,000,000/year","  Updated 30 Jan 2023, Added 12 Dec 2022 ", FOR RENT: 4 Bedroom Terrace Duplex with BQ Well secured estate with 24 hours electrici.. Read more ,ServicedNewly Built,4 beds4 baths5 Toilets
Victoria Island Lagos,"22,000,000/year","  Updated 30 Jan 2023, Added 28 Jan 2023 ", FOR RENT: FOR LEASE Commercial 6 Bedroom detached Duplex with a large compound & 3 sep.. Read more ,Newly Built,6 beds6 baths7 Toilets
Lekki Phase 1 Lekki Lagos,"10,000,000/year","  Updated 30 Jan 2023, Added 13 Dec 2022 ", FOR RENT: 4 Bedroom Semi Detached Duplex Rent: 10m Legal fee: 10% Agency fee: 10%.. Read more ,Newly Built,4 beds4 baths5 Toilets
Lekki Phase 1 Lekki Lagos,"9,600,000/year","  Updated 30 Jan 2023, Added 10 Jan 2023 ", FOR RENT: 10 User Space for rent Location Lekki Phase 1 Accommodation Fee: 9.6M .. Read more ,Furnished,0 beds0 baths0 Toilets
Oniru Victoria Island Lagos,"12,000,000/year","  Updated 30 Jan 2023, Added 20 Dec 2022 ", FOR RENT: A very spacious and well equipped 4 bedroom semi detached duplex with a room bq .. Read more ,ServicedNewly Built,4 beds4 baths5 Toilets
Lekki Phase 1 Lekki Lagos,"11,000,000/year","  Updated 30 Jan 2023, Added 20 Dec 2022 ", FOR RENT: TO LET 5 BEDROOM SEMI DETACHED Annual Rent: 11m Agent Fee: 10% Legal F.. Read more ,Newly Built,5 beds5 baths6 Toilets
Victoria Island Lagos,"7,000,000/year","  Updated 30 Jan 2023, Added 24 Jan 2023 ", FOR RENT: To let 3 bedroom flat with a room bq at dediolu estate Rent 7m Service ch.. Read more ,Newly Built,3 beds3 baths4 Toilets
Ikoyi Lagos,"18,000,000/year","  Updated 30 Jan 2023, Added 22 Dec 2022 "," FOR RENT: Location: Banana Island Rd, Ikoyi, Lagos. 5 ensuite bedrooms + bq with spacio.. Read more ",ServicedNewly Built,5 beds5 baths5 Toilets
Banana Island Ikoyi Lagos,"30,000,000/year","  Updated 30 Jan 2023, Added 22 Dec 2022 "," FOR RENT: 5bedroom detached house with 2rooms ba , garden and 40kva generator Annual.. Read more ",ServicedNewly Built,5 beds5 baths6 Toilets
Lekki Phase 1 Lekki Lagos,"10,000,000/year","  Updated 30 Jan 2023, Added 14 Dec 2022 ", FOR RENT: 4 Bedroom Semi Detached Duplex + BQ Annual Rent: 10m Legal fee: 10% Age.. Read more ,ServicedNewly Built,4 beds4 baths5 Toilets
Banana Island Ikoyi Lagos,"11,000,000/year","  Updated 30 Jan 2023, Added 15 Jan 2023 "," FOR RENT: TASTEFULLY FINISHED 3 BEDROOM FLAT WITH BQ, SWIMMING POOL, GYM AND ELEVATOR (UN.. Read more ",Newly Built,3 beds3 baths4 Toilets
Idado Lekki Lagos,"3,000,000/year","  Updated 30 Jan 2023, Added 13 Jan 2023 ", FOR RENT: 3 Bedroom serviced apartment FOR RENT Location Idado Estate Annual Rent: .. Read more ,ServicedNewly Built,3 beds3 baths4 Toilets
Lekki Palm City Estate Ajah Lagos,"4,000,000/year","  Updated 30 Jan 2023, Added 06 Jun 2022 "," FOR RENT: To Let 4 Bedroom detached duplex Location: Lekki Palm City Estate, Ajah Ann.. Read more ",Newly Built,0 beds0 baths0 Toilets
2nd Tollgate Chevron Lekki Lagos,"3,000,000/year","  Updated 30 Jan 2023, Added 16 Dec 2022 ", FOR RENT: FOR RENT SERVICED 3BEDROOM FLAT WITHIN A MINI ESTATE Location: 2ND TOLLGA.. Read more ,Serviced,3 beds3 baths4 Toilets
Oniru Victoria Island Lagos,"10,000,000/year","  Updated 30 Jan 2023, Added 16 Dec 2022 ", FOR RENT: FOUR BEDROOM TERRACE DUPLEX FOR RENT AMENITIES Includes: ** 4 Bedrooms en.. Read more ,ServicedNewly Built,4 beds4 baths5 Toilets
Lekki Phase 1 Lekki Lagos,"8,000,000/year","  Updated 30 Jan 2023, Added 23 Jan 2023 ", FOR RENT: Property Description For Rent !!! Service 4 Bedroom Terrace Duplex With BQ For.. Read more ,Newly Built,4 beds4 baths5 Toilets
Ikate Lekki Lagos,"6,000,000/year","  Updated 30 Jan 2023, Added 01 Jan 2023 "," FOR RENT: To Let 4 Bedroom Terrace Duplex with BQ Location Off Chisco Bustop, Ikate,.. Read more ",Newly Built,4 beds4 baths5 Toilets
Osapa London Lekki Lagos,"6,500,000/year","  Updated 30 Jan 2023, Added 25 Jan 2023 "," FOR RENT: 4 Bedroom Semi-detached duplex with BQ Location Osapa London, Lekki Lagos Sta.. Read more ",ServicedNewly Built,4 beds4 baths5 Toilets
Osapa London Lekki Lagos,"3,300,000/year","  Updated 30 Jan 2023, Added 25 Jan 2023 ", FOR RENT: 2 bedroom - 3.3M Serv charge 56500 Electricity 240kwt Min of electricity pu.. Read more ,ServicedNewly Built,2 beds2 baths3 Toilets
Ikate Lekki Lagos,"6,000,000/year","  Updated 30 Jan 2023, Added 10 Jun 2022 ", FOR RENT: A 4 bedroom duplex + 1 room boys quarter on corner piece that can park five cars.. Read more ,,0 beds0 baths0 Toilets
Oniru Victoria Island Lagos,"6,000,000/year","  Updated 30 Jan 2023, Added 06 Jan 2023 ", FOR RENT: To let 3 Bedroom Flat with a BQ Annual Rent: N6m Service Charge: N2m.. Read more ,ServicedNewly Built,3 beds3 baths4 Toilets
Lekki Phase 1 Lekki Lagos,"20,000,000/year","  Updated 30 Jan 2023, Added 20 Dec 2022 ", FOR RENT: FOR RENT* Luxury Brand New 4-bedrooms semi-detached duplex with one room servic.. Read more ,Newly Built,4 beds4 baths5 Toilets
Ikate Lekki Lagos,"7,000,000/year","  Updated 30 Jan 2023, Added 12 Dec 2022 ", FOR RENT: 4 Bedroom Semi-detached duplex with BQ Annual Rent: N7m Caution Fee: N500.. Read more ,Newly Built,4 beds4 baths5 Toilets
Ikate Lekki Lagos,"6,000,000/year","  Updated 30 Jan 2023, Added 24 Jan 2023 ", FOR RENT: To let Equivalve finished 3 bedroom terrace house with a room bq in serene.. Read more ,Newly Built,3 beds3 baths4 Toilets
Oniru Victoria Island Lagos,"35,000,000/year","  Updated 30 Jan 2023, Added 03 Jan 2023 ", FOR RENT: An exquisitely fully-furnished and fully-detached 5-bedroom duplex with 2-room B.. Read more ,ServicedNewly Built,5 beds5 baths6 Toilets
Abraham Adesanya Estate Ajah Lagos,"4,000,000/year","  Updated 30 Jan 2023, Added 15 Jan 2023 ", FOR RENT: FOR RENT 4 Bedroom Detached Duplex with BQ Location : Artican Beach Estat.. Read more ,Newly Built,4 beds4 baths5 Toilets
Oniru Victoria Island Lagos,"8,000,000/year","  Updated 30 Jan 2023, Added 06 Jan 2023 ", FOR RENT: 4 Bedroom Terrace with a BQ Annual Rent - 8m Service Charge: 1.5m(it inclu.. Read more ,ServicedNewly Built,4 beds4 baths5 Toilets
Lekki Lagos,"7,000,000/year","  Updated 30 Jan 2023, Added 27 Jan 2023 ", FOR RENT: Rent Alert 4 Bedroom Terrace Duplex with a Bq Location: Lekki Phase 1 .. Read more ,Newly Built,4 beds4 baths5 Toilets
Phase 2 Osborne Foreshore Estate Ikoyi Lagos,"15,000,000/year","  Updated 30 Jan 2023, Added 22 Dec 2022 "," FOR RENT: 5 Bedroom Semi Detached Duplex With 1BQ Rent :N15,000,000 per annum. Age.. Read more ",ServicedNewly Built,5 beds5 baths6 Toilets
Lekki Lagos,"4,500,000/year","  Updated 30 Jan 2023, Added 27 Jan 2023 "," FOR RENT: 4 bedroom semi-detached duplex with bq, inverter and Solar Panel Location: ik.. Read more ",Newly Built,4 beds4 baths5 Toilets
Banana Island Ikoyi Lagos,"30,000,000/year","  Updated 30 Jan 2023, Added 21 Dec 2022 "," FOR RENT: TO LET IN BANANA ISLAND, IKOYI, LAGOS Perfectly Maintained 5 Bedroom Semi-Det.. Read more ",ServicedNewly Built,5 beds5 baths6 Toilets
Lekki Lagos,"4,000,000/year","  Updated 30 Jan 2023, Added 22 Jan 2023 ", FOR RENT: To let self-serviced 3 bedroom apartment in an enclosed estate in Lekki right by.. Read more ,ServicedNewly Built,3 beds3 baths4 Toilets
Ikate Lekki Lagos,"10,000,000/year","  Updated 30 Jan 2023, Added 28 Jan 2023 ", FOR RENT: TO LET 5BEDROOM DETACHED DUPLEX WITH BQ Rent: 10million Agent:10% Legal:10% .. Read more ,Newly Built,5 beds5 baths6 Toilets
Ikate Lekki Lagos,"10,000,000/year","  Updated 30 Jan 2023, Added 24 Jan 2023 ", FOR RENT: TO LET 5 BEDROOM DETACHED DUPLEX WITH BQ Rent: 10million Agent:10% Legal:10%.. Read more ,Newly Built,5 beds5 baths6 Toilets
Salem Lekki Lagos,"5,000,000/year","  Updated 30 Jan 2023, Added 22 Jan 2023 "," FOR RENT: Brand new 4 bedroom Location: Salem, Lekki Rent=5m Caution=500k Leg.. Read more ",ServicedNewly Built,4 beds4 baths5 Toilets
Banana Island Ikoyi Lagos,"15,000,000/year","  Updated 30 Jan 2023, Added 14 Jan 2023 ", FOR RENT: An executive 2 bedroom furnished apartment with lovely waterview in Banana Islan.. Read more ,FurnishedServicedNewly Built,2 beds2 baths3 Toilets
Banana Island Ikoyi Lagos,"15,000,000/year","  Updated 30 Jan 2023, Added 19 Dec 2022 ", FOR RENT: *4BEDROOM TERRACE DUPLEX *DESCRIPTION Exquisite and spacious 4Bedrooms all e.. Read more ,ServicedNewly Built,4 beds4 baths5 Toilets
Parkview Estate Ikoyi Lagos,"8,000,000/year","  Updated 30 Jan 2023, Added 13 Jan 2023 "," FOR RENT: 4 Bedroom Terrace Duplex with BQ Location Parkview estate, Ikoyi Annual .. Read more ",ServicedNewly Built,4 beds4 baths5 Toilets
Ilasan Lekki Lagos,"3,500,000/year","  Updated 30 Jan 2023, Added 21 Jan 2023 "," FOR RENT: 2 bedroom flat Location ilasan, Lekki Lagos State Annual Rent: 3.5m Age.. Read more ",Newly Built,2 beds2 baths3 Toilets
Ikate Lekki Lagos,"2,500,000/year","  Updated 30 Jan 2023, Added 23 Jan 2023 ", FOR RENT: 2 bedroom flat Upstairs Location Ikate Annual Rent: 2.5m Service cha.. Read more ,Newly Built,2 beds2 baths3 Toilets
Lekki Phase 1 Lekki Lagos,"7,000,000/year","  Updated 30 Jan 2023, Added 20 Dec 2022 ", FOR RENT: 4 Bedroom Semi-detached duplex with a BQ Annual Rent: 7m Service Charge f.. Read more ,ServicedNewly Built,4 beds4 baths5 Toilets
Ologolo Lekki Lagos,"2,800,000/year","  Updated 30 Jan 2023, Added 21 Jan 2023 "," FOR RENT: 2 bedroom flat upstairs Location Ologolo, LEKKI Lagos State Rent(2,800,.. Read more ",Newly Built,2 beds2 baths3 Toilets
"Lekki Palm City Estate, Ado Ajah Lagos","3,200,000/year","  Updated 30 Jan 2023, Added 13 Dec 2022 ", FOR RENT: *4 BEDROOM Terrace DUPLEX in a self compound - All Room Ensuints - Fully Fur.. Read more ,Newly Built,4 beds4 baths5 Toilets
"Lekki Palm City Estate, Ado Ajah Lagos","3,500,000/year","  Updated 30 Jan 2023, Added 22 Dec 2022 ", FOR RENT: FOR RENT 4 Bedroom Terrace Duplex (corner piece) Price: N3.5M Agent fe.. Read more ,Newly Built,4 beds4 baths5 Toilets
Banana Island Ikoyi Lagos,"15,000,000/year","  Updated 30 Jan 2023, Added 19 Dec 2022 "," FOR RENT: Beautiful 4-bedroom marionette with a BQ located within a serene, ambient and se.. Read more ",ServicedNewly Built,4 beds4 baths5 Toilets
Abraham Adesanya Estate Ajah Lagos,"5,000,000/year","  Updated 30 Jan 2023, Added 13 Jan 2023 ", FOR RENT: FOR RENT 4 Bedroom Detached Duplex with Bq Location : Artican Beach Estat.. Read more ,Newly Built,4 beds4 baths5 Toilets
Lekki Lagos,"5,000,000/year","  Updated 30 Jan 2023, Added 22 Jan 2023 ", FOR RENT: To let serviced 3 bedroom maisonette with fitted kitchen and brand new ACs in an.. Read more ,,3 beds3 baths4 Toilets
Lekki Phase 1 Lekki Lagos,"4,000,000/year","  Updated 30 Jan 2023, Added 10 Jan 2023 ", FOR RENT: 2-bedroom flat apartment with a reading room in lekki phase 1 (right) Rent N4.. Read more ,Newly Built,2 beds2 baths3 Toilets
Agungi Lekki Lagos,"5,000,000/year","  Updated 30 Jan 2023, Added 26 Jan 2023 "," FOR RENT: 2-bedroom furnished apartment, Location Agungi, Lekki Lagos State Annual R.. Read more ",ServicedNewly Built,2 beds2 baths3 Toilets
Banana Island Ikoyi Lagos,"18,000,000/year","  Updated 30 Jan 2023, Added 22 Dec 2022 "," FOR RENT: A well Built, finished, and serviced 4 Bedroom Terrace Duplex within a Massive a.. Read more ",ServicedNewly Built,4 beds4 baths5 Toilets
Oniru Victoria Island Lagos,"6,000,000/year","  Updated 30 Jan 2023, Added 06 Jan 2023 ", FOR RENT: To let 3 Bedroom Flat with a BQ Annual Rent: 6m Service Charge: 2m .. Read more ,ServicedNewly Built,3 beds3 baths4 Toilets
"Olu Holloway Road, Ikoyi Lagos","13,500,000,000","  Updated 18 Feb 2023, Added 13 Nov 2022 ", FOR SALE: RESIDENTIAL HIGH RISE FOR SALE!!! A V.. Read more,, beds baths Toilets
Lekki Lagos,"1,200,000/year",  Added 30 Jan 2023 , FOR RENT: House for rent Lekki Phase 1 Lekki Lagos Total package 2m including GeN and.. Read more ,,0 beds0 baths0 Toilets
Onike Yaba Lagos,"1,000,000/year",  Added 29 Jan 2023 ," FOR RENT: Just Out?? Exquisitely finished, standard miniflat upstairs with POP fence ro.. Read more ",,1 beds1 baths2 Toilets
Shomolu Shomolu Lagos,"900,000/year",  Added 29 Jan 2023 ," FOR RENT: Just Out Exquisitely finished standard, newly built mini flat with kitchen c.. Read more ",FurnishedNewly Built,1 beds1 baths2 Toilets
Fola Agoro Yaba Lagos,"500,000/year",  Added 29 Jan 2023 , FOR RENT: Very beautiful Room self contain upstairs at ADIFASE STREET OFF FOLAGORO SHOMOL.. Read more ,,0 beds0 baths0 Toilets
Soluyi Gbagada Lagos,"1,700,000/year",  Added 29 Jan 2023 , FOR RENT: Just Out Exquisitely finished newly built 2 bedrooms ground flat both rooms.. Read more ,,2 beds2 baths3 Toilets
Jibowu Yaba Lagos,"750,000/year",  Added 29 Jan 2023 , FOR RENT: Very nice and clean minin flat upstairs in JIBOWU YABA Rent: 750k one year.. Read more ,,1 beds1 baths2 Toilets
Ogudu Lagos,"1,200,000/year","  Updated 29 Jan 2023, Added 27 Jan 2023 ", FOR RENT: 1 bedroom Flat / Apartment for rent Ogudu GRA Ogudu Lagos.. Read more ,Newly Built,1 beds1 baths2 Toilets
Ifako Gbagada Gbagada Lagos,"4,500,000/year",  Added 29 Jan 2023 ," FOR RENT: TO LET 4 bedroom semi detached duplex in Peace Garden Estate, In Glory Estate.. Read more ",,4 beds0 baths0 Toilets
Parkview Estate Ago Palace Okota Lagos,"850,000/year","  Updated 29 Jan 2023, Added 13 Dec 2022 ", FOR RENT: Rent a Fantastic 2 Bedroom Flat in Ago Palace Okota very decent new house with a.. Read more ,,2 beds2 baths3 Toilets
Eleganza Oral Estate Lekki Lagos,"4,500,000/year",  Added 29 Jan 2023 ," FOR RENT: DIRECT: Fully furnished 4 Bedroom semi-detached duplex in Oral Estate, Eleganza... Read more ",FurnishedServicedNewly Built,4 beds4 baths5 Toilets
Ogudu Gra Ogudu Lagos,"900,000/year",  Added 29 Jan 2023 ," FOR RENT: Newly built Miniflat in a gated compound with enough car pack.. It has pop,kitch.. Read more ",FurnishedNewly Built,1 beds1 baths2 Toilets
Akeem Odumosu Magodo Gra Phase 1 Ojodu Lagos,"2,200,000/year",  Added 29 Jan 2023 , FOR RENT: Well maintained 3bedroom flat in magodo phase1 all rooms ensuite with p.o.p ceil.. Read more ,Newly Built,3 beds3 baths3 Toilets
Western Area Magodo Gra Phase 1 Ojodu Lagos,"2,200,000/year",  Added 29 Jan 2023 , FOR RENT: Tastefully finished 3bedroom flat in magodo phase1 all rooms ensuite with p.o.p .. Read more ,,3 beds3 baths4 Toilets
Harmony Estate Magodo Gra Phase 1 Ojodu Lagos,"6,000,000/year",  Added 29 Jan 2023 , FOR RENT: Tastefully finished 5bedroom detached duplex in magodo phase1 all rooms ensuite .. Read more ,Newly Built,5 beds5 baths5 Toilets
Shoreline Estate Lekki Phase 1 Lekki Lagos,"25,000,000",  Added 28 Jan 2023 , FOR RENT: Newly Built Spacious 5 Bedroom Semi Detached House+ BQ at Shoreline Estate Ikoyi.. Read more ,Newly Built,0 beds0 baths0 Toilets
Addyhollyni Lekki Phase 1 Lekki Lagos,"11,000,000",  Added 28 Jan 2023 , FOR RENT: Brand New Spacious 5 Bedroom semi detached Duplex with BQ rent in a secured e.. Read more ,Newly Built,0 beds0 baths0 Toilets
Oba Elegushi Estate Lekki Phase 2 Lekki Lagos,"450,000/year",  Added 28 Jan 2023 ," FOR RENT: Vacant room in 3 bedroom shared apartment, in a safe and serviced estate along .. Read more ",FurnishedServiced,1 beds1 baths1 Toilets
"Koloba, Off Alaja Road Ayobo Ipaja Lagos","550,000/year",  Added 28 Jan 2023 ," FOR RENT: Tastefully built 2bedroom flat for rent at Koloba, Ayobo. Price: ?500k annum.. Read more ",,2 beds2 baths2 Toilets
Abiola Estate Ayobo Ipaja Lagos,"600,000/year",  Added 28 Jan 2023 , FOR RENT: Tastefully built 2 bedroom flat with pop ceilings for rent at Abiola Estate phas.. Read more ,Serviced,2 beds3 baths3 Toilets
"Paiko, Along Ejigbo Road, Off Chrisland School Idimu Egbe Idimu Lagos","550,000/year",  Added 28 Jan 2023 ," FOR RENT: Tastefully built 2Bedroom with all rooms ensuit, prepaid metre, 3tenants in the .. Read more ",,2 beds2 baths2 Toilets
Igbo Efon Lekki Lagos,"900,000/year","  Updated 28 Jan 2023, Added 12 Jan 2023 ", FOR RENT: Rent 900k Service charge 100k .. Read more ,, beds baths Toilets
"Assets Close, By Safeway Bus Stop, Sangotedo Sangotedo Lagos","2,000,000/year",  Added 28 Jan 2023 , FOR RENT: Brown coloured building by the Anglican Church premises.. Read more ,,4 beds4 baths5 Toilets
Chevron Lekki Lagos,"100,000/month",  Added 27 Jan 2023 ," FOR RENT: The property is furnished already, just come with your clothes. Clean water, ste.. Read more ",FurnishedServicedNewly Built,0 beds0 baths0 Toilets
Chevron Lekki Lagos,"100,000/month",  Added 27 Jan 2023 , FOR RENT: Steady light and clean water .. Read more ,FurnishedServicedNewly Built,1 beds1 baths1 Toilets
Chevron Lekki Lagos,"800,000/year",  Added 27 Jan 2023 , FOR RENT: Very nice self contained available for rent.. Read more ,FurnishedServicedNewly Built,1 beds1 baths1 Toilets
Ogudu Lagos,"1,300,000/year",  Added 27 Jan 2023 , FOR RENT: A standard room self contains at ogudu garden valley gra #1.3m slightly negotiab.. Read more ,,1 beds1 baths1 Toilets
"Akilo Road, Ogba Ikeja Lagos","45,000,000/year",  Added 27 Jan 2023 ," FOR RENT: For Lease: Warehouse + Office at Akilo Road, Ogba, Ikeja, Lagos. Warehou.. Read more ",,0 beds0 baths0 Toilets
Ilasan Lekki Lagos,"2,400,000/year",  Added 27 Jan 2023 , FOR RENT: Newly built 2 bedroom apartment in a serene neighborhood estate Features -.. Read more ,ServicedNewly Built,2 beds2 baths3 Toilets
Alapere Kosofe Ikosi Lagos,"700,000/year",  Added 27 Jan 2023 ," FOR RENT: A decent mini flat in a gated community in alapere, ketu Lagos. Comes with clean.. Read more ",,1 beds1 baths1 Toilets
Alapere Kosofe Ikosi Lagos,"1,600,000/year",  Added 27 Jan 2023 ," FOR RENT: 3 bedroom apartment all room ensuit at bakare st off oriola, alapere ketu Lagos... Read more ",,3 beds3 baths4 Toilets
Alagomeji Yaba Lagos,"1,400,000/year",  Added 27 Jan 2023 , FOR RENT: We have two rooms office space for rent in a conducive environment for corporat.. Read more ,,0 beds0 baths0 Toilets
Jibowu Yaba Lagos,"600,000/year",  Added 27 Jan 2023 , FOR RENT: A furnished studio apartment at jibowu Fadeyi Yaba Lagos yearly. Rent. .. Read more ,,0 beds0 baths0 Toilets
Akoka Yaba Lagos,"600,000/year",  Added 27 Jan 2023 ," FOR RENT: A newly Built Room self contain @ Pako, Akoka Yaba Lagos Very Big, Decent, and .. Read more ",Newly Built,0 beds0 baths0 Toilets
Alapere Kosofe Ikosi Lagos,"1,600,000/year",  Added 27 Jan 2023 , FOR RENT: 3 bedroom Flat / Apartment for rent Alapere Kosofe/Ikosi Lagos.. Read more ,,3 beds3 baths4 Toilets
Fola Agoro Yaba Lagos,"1,500,000/year",  Added 27 Jan 2023 , FOR RENT: Exquisitely finished standard two-bedroom flat at FOLAGORO YABA LAGOS with two t.. Read more ,,2 beds2 baths3 Toilets
Aguda Surulere Lagos,"1,800,000/year",  Added 27 Jan 2023 ," FOR RENT: Just Out Exquisitely finished, standard, and spacious 2 bedroom flat downstai.. Read more ",,2 beds2 baths3 Toilets
Ebute Metta Yaba Lagos,"2,500,000/year",  Added 27 Jan 2023 ," FOR RENT: Exquisitely finished, fantastic and fabulous 3 bedroom flat all room en-suite, w.. Read more ",,3 beds3 baths4 Toilets
Ogudu Lagos,"750,000/year",  Added 27 Jan 2023 , FOR RENT: Relatively new mini flat with all modern facilities inside AN ESTATE OGUDU ORI.. Read more ,,1 beds1 baths2 Toilets
Onike Yaba Lagos,"750,000/year",  Added 27 Jan 2023 ," FOR RENT: Exquisitely finished, clean and standard mini flat upstairs PEDRO IWAYA ONIKE, c.. Read more ",,1 beds1 baths2 Toilets
Surulere Lagos,"2,000,000/year",  Added 27 Jan 2023 ," FOR RENT: TO LET 2 bedroom flat brand new with all rooms ensuite, fully installed gas a.. Read more ",Newly Built,2 beds2 baths3 Toilets
Ifako Gbagada Gbagada Lagos,"1,000,000/year","  Updated 27 Jan 2023, Added 21 Jan 2023 "," FOR RENT: Newly built miniflat in a nice neighborhood that has security,water and light..... Read more ",Newly Built,1 beds2 baths2 Toilets
Ikoyi Lagos,"13,000,000/year",  Added 26 Jan 2023 , FOR RENT: Brand new 3 bedroom apartment with bq elevator swimming pool and gym off Kingswa.. Read more ,,0 beds0 baths0 Toilets
Badore Ajah Lagos,"480,000/year",  Added 26 Jan 2023 ," FOR RENT: I’m relocating and renting out my space. No caution, agency or agreement fee. Ju.. Read more ",ServicedNewly Built,1 beds1 baths1 Toilets
Chevron Lekki Lagos,"4,000,000/year",  Added 26 Jan 2023 ," FOR RENT: Beautiful 3 bedroom apartment with ample parking space in Chevyview Estate, Chev.. Read more ",,3 beds3 baths4 Toilets
Sangotedo Lagos,"750,000/year",  Added 26 Jan 2023 ," FOR RENT: Well maintained 2 bedroom flat at Ogidan, Sangotedo. Rent 750k Agency 10% Le.. Read more ",Furnished,2 beds0 baths2 Toilets
Alaka Iponri Surulere Lagos,"2,700,000/year","  Updated 26 Jan 2023, Added 26 Jan 2023 ", FOR RENT: A lovely and nice well finished 2 bedroom duplex with just 3 people in the compo.. Read more ,,2 beds2 baths3 Toilets
Lekki Phase 1 Lekki Lagos,"5,000,000/year","  Updated 26 Jan 2023, Added 10 Jan 2023 ", FOR RENT: *SEMI-BRIEF *2 UNITS OF 3 BEDROOM FLAT WITH BQ *LOCATION : LEKKI PHASE 1 *.. Read more ,,3 beds3 baths4 Toilets
Lekki Phase 1 Lekki Lagos,"5,000,000/year","  Updated 26 Jan 2023, Added 10 Jan 2023 ", FOR RENT: *SEMI DIRECT LETTING *LOVELY NEWLY RENOVATED THREE BEDROOM FLAT WITH A BQ(UPS.. Read more ,,3 beds3 baths3 Toilets
Lekki Phase 1 Lekki Lagos,"4,200,000/year","  Updated 26 Jan 2023, Added 10 Jan 2023 "," FOR RENT: 3bedroom with a bq upstairs, Rent 4.2 AL10% each Caution 400k Refundable .. Read more ",,3 beds3 baths4 Toilets
