Location,Price_Period,Date_Added_Updated,Description,Serviced,Bed_Bath_Toilet
Orchid Road Jakande Lekki Lagos,"3,000,000/year","  Updated 13 Feb 2023, Added 31 Dec 2022 ", FOR RENT: Good evening 4 bedroom duplex Location orchid Rent 3m Caution 200 Legal .. Read more ,ServicedNewly Built,4 beds4 baths5 Toilets
Beckley Estate Abule Egba Abule Egba Lagos,"1,000,000/year","  Updated 13 Feb 2023, Added 14 Jan 2023 "," FOR RENT: Brand New 2bedroom with 3toiles all round pop , just 3 in compand prepaid meters.. Read more ",Newly Built,2 beds0 baths0 Toilets
Demurin Road Ketu Lagos,"800,000/year","  Updated 13 Feb 2023, Added 09 Jan 2023 ", FOR RENT: A luxury well finished 2 bedroom flat all rooms Ensuite group floor at CAC stree.. Read more ,,2 beds2 baths2 Toilets
Falomo Awolowo Road Ikoyi Lagos,"10,000,000/year","  Updated 13 Feb 2023, Added 09 Jan 2023 ", FOR RENT: A Luxury Brand new 3 bedroom apartment is available for let in Ikoyi with Swim.. Read more ,ServicedNewly Built,3 beds4 baths4 Toilets
Ikota Gra Ikota Lekki Lagos,"3,500,000/year","  Updated 13 Feb 2023, Added 03 Jan 2023 ", FOR RENT: DIRECT MANDATE(LEASE) AT IKOTA GRA* Self-serviced 4 Bedroom Semidetached Duplex.. Read more ,Newly Built,4 beds4 baths5 Toilets
Osapa London Lekki Lagos,"3,000,000/year","  Updated 13 Feb 2023, Added 25 Jan 2023 ", FOR RENT: Spacious 2-Bedroom Apartment Features!!! All Rooms En-suite -Spacious Bedr.. Read more ,Serviced,2 beds2 baths3 Toilets
Ikota Lekki Lagos,"3,500,000/year","  Updated 13 Feb 2023, Added 12 Jan 2023 ", FOR RENT: Spacious 3-bedroom Flat in a Serene Estate Feature!! Street Light Platy g.. Read more ,ServicedNewly Built,3 beds3 baths4 Toilets
Lekki Phase 1 Lekki Lagos,"6,500,000/year","  Updated 13 Feb 2023, Added 08 Jan 2023 ", FOR RENT: luxury 3maisonette with bq at lekki phase 1 Rent 6.5m service charge 1.5m .. Read more ,ServicedNewly Built,3 beds3 baths4 Toilets
Ikota Villa Estate Lekki Lagos,"5,000,000/year","  Updated 13 Feb 2023, Added 07 Jan 2023 ", FOR RENT: New Listing Alert! BRAND NEW 4 BEDROOM SEMI DETACHED DUPLEX WITH BQ WELL FIN.. Read more ,,4 beds4 baths4 Toilets
In Bera Estate Chevron Lekki Lagos,"1,600,000/year","  Updated 13 Feb 2023, Added 01 Feb 2023 ", FOR RENT: Hurry .. Read more ,Serviced,0 beds0 baths0 Toilets
"Along Main Moniya Alabata Road Near Railway Terminal Area, Moniya Ibadan Oyo","1,000,000","  Updated 18 Feb 2023, Added 17 Dec 2022 ", FOR SALE: ????? ????????: A PLOT OF LAND ALONG TILED ROAD NEAR RAILWAY TERMINAL MONIYA IBA.. Read more,, beds baths Toilets
Lekki Lagos,"10,000,000/year","  Updated 13 Feb 2023, Added 18 Jan 2023 ", FOR RENT: Tastefully Fitted 4-Bedroom Semi-Detached House Feature!! Pantry Car Port.. Read more ,Newly Built,4 beds4 baths5 Toilets
Ikota Gra Ikota Lekki Lagos,"4,500,000/year","  Updated 13 Feb 2023, Added 12 Dec 2022 "," FOR RENT: FOR LEASE: 4 Bedroom Semidetached Duplex N4,500,000 per annum(slightly negot.. Read more ",,4 beds4 baths4 Toilets
Agungi Lekki Lagos,"1,600,000/year","  Updated 13 Feb 2023, Added 30 Jan 2023 ", FOR RENT: Now available for rent Standard studio apartment in Obamusa estate in agungi .. Read more ,Serviced,0 beds0 baths0 Toilets
Ado Ajah Lagos,"700,000/year","  Updated 13 Feb 2023, Added 17 Jan 2023 ", FOR RENT: Now Available For Rent A 20sqm shop with inbuilt toilet Spacious shop and .. Read more ,Serviced,0 beds0 baths0 Toilets
Apapa Lagos,"900,000,000/year","  Updated 13 Feb 2023, Added 30 Jul 2022 ", FOR RENT: Tank Farm For Lease Tank farm for lease at Apapa Dockyard with Kirikiri and I.. Read more ,, beds baths Toilets
Facing Akowonjo Road Dopemu Akowonjo Alimosho Lagos,"3,900,000","  Updated 13 Feb 2023, Added 08 Mar 2022 ", FOR RENT: Standard commercial partitioning open space Hall wearhouse in a good location of.. Read more ,,0 beds0 baths0 Toilets
Infinity Estate Ajah Lagos,"3,000,000/year","  Updated 13 Feb 2023, Added 10 Jan 2023 ", FOR RENT: Modern 5bedroom semi detached Duplex with BQ available for rent at Infinity esta.. Read more ,,5 beds5 baths5 Toilets
Lekki Lagos,"9,000,000/year","  Updated 13 Feb 2023, Added 31 Jan 2023 ", FOR RENT: New luxury standard 2 bedroom in a good location. With elevator.. Read more ,,2 beds0 baths0 Toilets
Ologolo Lekki Lagos,"4,000,000/year","  Updated 13 Feb 2023, Added 07 Feb 2023 ", FOR RENT: *For Rent/Sale 2 units of serviced 4 bedrooms terrace duplex. Location: Eag.. Read more ,Serviced,4 beds4 baths5 Toilets
Victoria Island Lagos,"800,000/year","  Updated 13 Feb 2023, Added 01 Feb 2023 ", FOR RENT: Luxury Commercial Office Space With Excellent Architecture Feature!! Clinic.. Read more ,,1 beds1 baths4 Toilets
Banana Island Ikoyi Lagos,"30,000,000/year","  Updated 13 Feb 2023, Added 04 Jan 2023 "," FOR RENT: *To let in Banana Island, Ikoyi, Lagos Perfectly maintained 5 Bedroom semi-de.. Read more ",,5 beds6 baths6 Toilets
Ikate Lekki Lagos,"8,000,000/year","  Updated 13 Feb 2023, Added 29 Jan 2023 ", FOR RENT: TO LET!!! A newly built Three(3) Bedroom Flat with 1-Room Boy's Quarters and .. Read more ,ServicedNewly Built,3 beds3 baths4 Toilets
Off Mobil Road Ilaje Ajah Lagos,"1,500,000/year","  Updated 13 Feb 2023, Added 19 Jan 2023 ", FOR RENT: Now Letting !!! - New built 2 bedroom flat - Spacious living room and room.. Read more ,ServicedNewly Built,2 beds2 baths3 Toilets
Off Aina ßtr Ojodu Berger Ojodu Lagos,"8,000,000/year","  Updated 13 Feb 2023, Added 18 Dec 2022 ", FOR RENT: *Direct brief *30 rooms hotel for lease off aina street ojodu lagos *Prop.. Read more ,,0 beds0 baths0 Toilets
Vgc Extension Lekki Lagos,"4,500,000/year","  Updated 13 Feb 2023, Added 06 Jan 2023 ", FOR RENT: 4 bedroom semi detached house with a bq available for rent at VGC Extension lek.. Read more ,,4 beds4 baths4 Toilets
Berger Ojodu Lagos,"800,000/year","  Updated 13 Feb 2023, Added 12 Jun 2022 "," FOR RENT: Re t #800,000 Agency fee 10% Legal 10% Service charge 20% .. Read more ",Newly Built,0 beds0 baths1 Toilets
Lekki Lagos,"950,000/year","  Updated 13 Feb 2023, Added 07 Feb 2023 ", FOR RENT: Rent: 950k 10% Agency 10% Agreement Location: Opposite Southern view Estate.. Read more ,Serviced,0 beds0 baths0 Toilets
Lekki Phase 1 Lekki Lagos,"4,000,000/year","  Updated 13 Feb 2023, Added 07 Jan 2023 ", FOR RENT: 40sqm shop space is available for let in Lekki Phase 1 Price 4m Service charge.. Read more ,, beds baths Toilets
Victoria Island Lagos,"20,000,000/year","  Updated 13 Feb 2023, Added 21 Jan 2023 ", FOR RENT: 2 unite of Massive 7-Bedroom Semi-detached Features!!! -2 Rooms BQ Each -.. Read more ,,7 beds7 baths8 Toilets
Ikota Lekki Lagos,"2,000,000/year","  Updated 13 Feb 2023, Added 14 Jan 2023 ", FOR RENT: Rent alert Nice 2 bedroom all room en-suite modern house with balcony and 3 t.. Read more ,Serviced,2 beds2 baths3 Toilets
Adeniyi Jones Ikeja Lagos,"100,000,000","  Updated 19 Feb 2023, Added 26 Sep 2022 ", FOR SALE: BRAND NEW 4 BEDROOM TERRACE DUPLEX FOR SALE. Amenities: - [ ] Fitted Kitch.. Read more,,4 beds0 baths0 Toilets
Ikota Lekki Lagos,"2,000,000/year","  Updated 13 Feb 2023, Added 14 Jan 2023 ", FOR RENT: 2bedroom 2M ALC 10 each no dey or Jesus .. Read more ,Serviced,2 beds2 baths3 Toilets
Ilaje Ajah Lagos,"1,200,000/year","  Updated 13 Feb 2023, Added 25 Jan 2023 ", FOR RENT: A well located mall 22sqm in size Mall on major busy road Good power supply .. Read more ,ServicedNewly Built,0 beds0 baths0 Toilets
Ikate Lekki Lagos,"5,500,000/year","  Updated 13 Feb 2023, Added 09 Feb 2023 ", FOR RENT: Newly Renovated Service 4 Bedroom Terrace Duplex for let in Ikate Lekki Lagos. .. Read more ,Serviced,4 beds4 baths5 Toilets
Osapa London Lekki Lagos,"3,500,000/year","  Updated 13 Feb 2023, Added 24 Jan 2023 ", FOR RENT: Brand New 3-Bedroom Apartment Features!!! -Brand New All Rooms En-suite .. Read more ,Newly Built,3 beds2 baths4 Toilets
Ajayi Road Ogba Lagos,"1,600,000/year","  Updated 13 Feb 2023, Added 25 Jan 2023 "," FOR RENT: FOR LEASE PROPERTY: 3 UNITS OF 2 BEDROOM FLATS WITH POP, PREPAID METER, 3 TOIL.. Read more ",,2 beds2 baths3 Toilets
Osapa London Lekki Lagos,"3,000,000/year","  Updated 13 Feb 2023, Added 08 Jan 2023 ", FOR RENT: Fully serviced 3bedroom apartment available for rent at Osapa London Lekki R.. Read more ,,3 beds3 baths3 Toilets
Agungi Lekki Lagos,"2,800,000/year","  Updated 13 Feb 2023, Added 09 Feb 2023 ", FOR RENT: Neatly Maintained 2 Bedroom Flat with a Beautiful Ambiance is now for rent in Ag.. Read more ,Serviced,2 beds2 baths3 Toilets
Ikota Lekki Lagos,"2,000,000/year","  Updated 13 Feb 2023, Added 25 Jan 2023 ", FOR RENT: Available For Rent 2 bedroom bungalow in a serene environment Not far from .. Read more ,Serviced,2 beds2 baths3 Toilets
"Platinum Mall, Ikota 1st Gate Ikota Lekki Lagos","600,000/year","  Updated 13 Feb 2023, Added 08 Jan 2023 ", FOR RENT: --- 24sqm shop/office open for lease --- Available on ground & upper floor ---.. Read more ,ServicedNewly Built,0 beds0 baths0 Toilets
Orchid Road Lekki Lagos,"3,000,000/year","  Updated 13 Feb 2023, Added 01 Jan 2023 "," FOR RENT: TO LET IN AN ESTATE OFF ORCHID ROAD, LEKKI 4 bedroom duplex Rent:3m Agency:.. Read more ",,4 beds4 baths5 Toilets
Ikate Lekki Lagos,"4,000,000/year","  Updated 13 Feb 2023, Added 01 Feb 2023 "," FOR RENT: Brand New 2 Bedroom Apartment at Ikate, Lekki-Lagos. Rent - N4m Agency Fee -.. Read more ",ServicedNewly Built,2 beds2 baths3 Toilets
Governors Road Ikotun Igando Lagos,"600,000/year","  Updated 13 Feb 2023, Added 09 Feb 2023 ", FOR RENT: *Just Out A newly built Mini flat apartment is available for rent *Featur.. Read more ,,0 beds0 baths0 Toilets
Chevron Lekki Lagos,"600,000/year","  Updated 13 Feb 2023, Added 21 Jan 2023 ", FOR RENT: DIRECT BRIEF: Fully Serviced room boys quarters with its own kitchen @ Bourdi.. Read more ,,0 beds0 baths0 Toilets
On The Major Road Jakande Lekki Lagos,"1,500,000/year","  Updated 13 Feb 2023, Added 19 Dec 2022 "," FOR RENT: Very big Shop space at jakande first gate by fcmb bank, lekki Lagos Suitable .. Read more ",,0 beds0 baths2 Toilets
Idado Lekki Lagos,"1,300,000/year","  Updated 13 Feb 2023, Added 03 Feb 2023 ", FOR RENT: 1 bedroom Flat / Apartment for rent Idado Lekki Lagos.. Read more ,Serviced,1 beds1 baths1 Toilets
Lekki Lagos,"11,000,000/year","  Updated 13 Feb 2023, Added 27 Jan 2023 ", FOR RENT: Spacious 4-Bedroom detached Duplex Feature!! 2 Rooms BQ 24hrs power Supp.. Read more ,,4 beds4 baths5 Toilets
Divine Estate Amuwo Odofin Amuwo Odofin Lagos,"2,500,000/year","  Updated 13 Feb 2023, Added 28 Jan 2023 ", FOR RENT: Newly renovated and extravagantly finished three bedroom apartment at Divine est.. Read more ,,3 beds0 baths0 Toilets
Lekki Lagos,"6,000,000/year","  Updated 13 Feb 2023, Added 27 Jan 2023 "," FOR RENT: To let Spacious 4 Bedroom Semi Detached duplex with a maids room , all rooms .. Read more ",,4 beds4 baths5 Toilets
Lekki Lagos,"150,000,000/year","  Updated 13 Feb 2023, Added 27 Jan 2023 ", FOR RENT: JUST LISTED LUXURY 3 BEDROOM APARTMENT WITH A ROOM BQ FEATURES: Brand New.. Read more ,ServicedNewly Built,3 beds4 baths4 Toilets
Osapa London Lekki Lagos,"3,000,000/year","  Updated 13 Feb 2023, Added 17 Jan 2023 ", FOR RENT: 2 bedroom Flat / Apartment for rent Osapa London Lekki Lagos.. Read more ,Serviced,2 beds2 baths2 Toilets
Chevron Lekki Lagos,"155,000,000","  Updated 19 Feb 2023, Added 15 Dec 2022 "," FOR SALE: 5 Bedroom Detached Duplex with Bq Location: Chevron Tollgate. Lekki, Lagos ,.. Read more",Newly Built,5 beds5 baths5 Toilets
Agungi Lekki Lagos,"2,000,000/year","  Updated 13 Feb 2023, Added 30 Jan 2023 ", FOR RENT: Rent alert In obamusa estate agungi *Very specious mini flat downstairs with .. Read more ,,1 beds1 baths2 Toilets
Off Adeola Odeku Street Victoria Island Lagos,"12,000,000/year","  Updated 13 Feb 2023, Added 04 Jan 2023 ", FOR RENT: Fully Serviced 4bedroom pent house available for Rent Off Adeola Odeku Victoria .. Read more ,,4 beds4 baths4 Toilets
Old Ikoyi Ikoyi Lagos,"11,500,000/year","  Updated 13 Feb 2023, Added 19 Jan 2023 ", FOR RENT: Luxury & Service 3-Bedroom Terrace Features!! Gym Dining Ares 1 Room BQ.. Read more ,Serviced,3 beds3 baths4 Toilets
Ikate Lekki Lagos,"6,000,000/year","  Updated 13 Feb 2023, Added 19 Jan 2023 ", FOR RENT: Luxury 4-Bedroom Terrace Duplex Feature!! 1 Room BQ Self Serviced 24hrs .. Read more ,,4 beds4 baths5 Toilets
P&t Baruwa Ipaja Lagoe Akowonjo Alimosho Lagos,"1,500,000/year","  Updated 13 Feb 2023, Added 23 Dec 2022 ", FOR RENT: Decent and clean 2 bedroom Duplex at High castle Estate Boystown with all rooms .. Read more ,,0 beds0 baths0 Toilets
Megamond Estate Lekki Counting Home Ikota Lekki Lagos,"2,500,000/year","  Updated 13 Feb 2023, Added 06 Jan 2023 ", FOR RENT: *Ikota Direct Brief for rent* Units of two and three bedroom apartments on va.. Read more ,Newly Built,2 beds2 baths3 Toilets
Ilasamaja Mushin Lagos,"2,200/sqm","  Updated 13 Feb 2023, Added 09 Feb 2023 ", FOR RENT: *Just out *7000ft2 Warehouse along Oshodi apapa express. close to Iyana is.. Read more ,,0 beds0 baths0 Toilets
Ikate Lekki Lagos,"4,000,000/year","  Updated 13 Feb 2023, Added 08 Jan 2023 ", FOR RENT: Fully service 2 bedroom Rent 4m Location ikate Agency 10 percent Lagal.. Read more ,ServicedNewly Built,2 beds2 baths3 Toilets
Lekki Lagos,"5,000,000/year","  Updated 13 Feb 2023, Added 13 Jan 2023 ", FOR RENT: New Self serviced 3-bedroom Flat Feature!! Fitted Kitchen All Rooms En-s.. Read more ,,3 beds3 baths4 Toilets
Abaranje Ikotun Igando Lagos,"600,000/year","  Updated 13 Feb 2023, Added 03 Feb 2023 ", FOR RENT: 2 bedroom flat at abaranje ikotun Lagos 2 toilets and 3 bathroom ensuit with Pop.. Read more ,,2 beds2 baths2 Toilets
Adeola Odeku Victoria Island Lagos,"8,000,000/year","  Updated 13 Feb 2023, Added 10 Jan 2023 ", FOR RENT: A newly refurbished 3 bedroom apartment is available for let in Victoria Island .. Read more ,Serviced,3 beds3 baths4 Toilets
Tomas Ajufo Estate Alimosh Akowonjo Alimosho Lagos,"2,000,000/year","  Updated 13 Feb 2023, Added 10 Jan 2023 ", FOR RENT: Executive and newly built 2 bedroom flat at Thomas Ajufor estate Alimosho road.. Read more ,,2 beds2 baths0 Toilets
Ikota Lekki Lagos,"2,500,000/year","  Updated 13 Feb 2023, Added 15 Jan 2023 ", FOR RENT: New Available to rent *2bedroom newly built in ikota GRA upstairs with wide b.. Read more ,Newly Built,2 beds2 baths3 Toilets
Osapa London Lekki Lagos,"1,700,000/year","  Updated 13 Feb 2023, Added 22 Jan 2023 ", FOR RENT: Studio apartment with it own kitchen Rent 1.7M Service charge 250k .. Read more ,ServicedNewly Built,0 beds0 baths0 Toilets
Egbe Idimu Lagos,"500,000/year","  Updated 13 Feb 2023, Added 30 Jan 2023 "," FOR RENT: Letting Clean ,Relatively New Portable 2 Bedroom with pop Price - #500k P.. Read more ",Newly Built,2 beds2 baths0 Toilets
Chevron Alternative Route Lekki Lagos,"6,000,000/year","  Updated 13 Feb 2023, Added 06 Jan 2023 ", FOR RENT: Brand New 4bedroom detached house with bq available for rent off off Chevron al.. Read more ,,4 beds4 baths4 Toilets
Ifako Gbagada Gbagada Lagos,"4,500,000/year","  Updated 13 Feb 2023, Added 30 Jan 2023 "," FOR RENT: FRESH LETTING Decent 4 Bedroom Semi Detached Duplex in Peace Garden Estate, .. Read more ",,4 beds4 baths4 Toilets
Lekki Phase 1 Lekki Lagos,"1,700,000/year","  Updated 13 Feb 2023, Added 28 Oct 2022 "," FOR RENT: 1. Executive Serviced Studio Apartment @ 13c Yeye olofin street, lekki 1 R- .. Read more ",Serviced,0 beds0 baths0 Toilets
Ikate Lekki Lagos,"6,000,000/year","  Updated 13 Feb 2023, Added 25 Jan 2023 ", FOR RENT: Spacious 4-Bedroom Terrace Features!!! -Brand New All Rooms En-suite -Sp.. Read more ,Newly Built,4 beds4 baths5 Toilets
Chevron Lekki Lagos,"5,000,000/year","  Updated 13 Feb 2023, Added 06 Feb 2023 ", FOR RENT: Now Available to rent *Standard 5 bedroom fully detached with a specious Bq i.. Read more ,,5 beds5 baths6 Toilets
Old Ikoyi Ikoyi Lagos,"10,000,000/year","  Updated 13 Feb 2023, Added 24 Jan 2023 ", FOR RENT: Commercial Shop Space Feature!! 100SQM Newly Built Front Shop Ample.. Read more ,ServicedNewly Built,1 beds1 baths1 Toilets
Parkview Estate Ikoyi Lagos,"4,500,000/year","  Updated 13 Feb 2023, Added 15 Jan 2023 "," FOR RENT: Well, Maintenance 3 bedroom flat available for rent at Parkview estate, Ikoyi La.. Read more ",,3 beds3 baths3 Toilets
Orchid Road By Victoria Bay Lekki Lagos,"3,500,000/year","  Updated 13 Feb 2023, Added 10 Jan 2023 ", FOR RENT: Rent Alert *4bedroom terrace for rent *Ochid road by Victoria bay ??Rent .. Read more ,ServicedNewly Built,4 beds4 baths5 Toilets
Lekki Lagos,"10,000,000/year","  Updated 13 Feb 2023, Added 31 Jan 2023 ", FOR RENT: For Rent: Suitable for Residential & Commercial Purposes. Located in Lekki Pha.. Read more ,,4 beds4 baths5 Toilets
Ologolo Lekki Lagos,"1,800,000/year","  Updated 13 Feb 2023, Added 23 Jan 2023 ", FOR RENT: Out now to rent *Well built standard mini flat upstairs just two people in t.. Read more ,Newly Built,1 beds1 baths1 Toilets
Lekki Phase 1 Lekki Lagos,"14,000,000/year","  Updated 13 Feb 2023, Added 29 Dec 2022 ", FOR RENT: A newly refurbished 6-Bedroom semi-detached house is available for let in Lekki .. Read more ,,5 beds6 baths6 Toilets
Abaranje Ikotun Igando Lagos,"300,000/year","  Updated 13 Feb 2023, Added 27 Jan 2023 ", FOR RENT: *Cheep 2 bedroom to let A neatly used 2 bedroom flat is available for rent at.. Read more ,Furnished,2 beds2 baths0 Toilets
Estate Sangotedo Ajah Lagos,"1,600,000/year","  Updated 13 Feb 2023, Added 09 Jan 2023 "," FOR RENT: TO LET BRAND NEW 3 BEDROOM TERRACE DUPLEX ESTATE SANGOTEDO LAGOS, Rent #1.6.. Read more ",Newly Built,3 beds3 baths4 Toilets
Lekki Phase 1 Lekki Lagos,"10,000,000/year","  Updated 13 Feb 2023, Added 16 Jan 2023 ", FOR RENT: Spacious 4-Bedroom Terrace Feature!! Serene Area Fully Fitted Kitchen .. Read more ,ServicedNewly Built,4 beds5 baths5 Toilets
Lekki Phase 1 Lekki Lagos,"17,000,000/year","  Updated 13 Feb 2023, Added 19 Jan 2023 ", FOR RENT: Spacious 5-Bedroom Detached House Feature!! 2 Room BQ Fitted Kitchen Al.. Read more ,,5 beds5 baths6 Toilets
Salem Ilasan Lekki Lagos,"120,000,000/year","  Updated 13 Feb 2023, Added 16 Dec 2022 ", FOR RENT: A tastefully beautiful 4 Bedroom Terrance duplex Rent N120m Tittle documen.. Read more ,ServicedNewly Built,4 beds4 baths5 Toilets
Magodo Phase 2 Gra Shangisha Alausa Ikeja Lagos,"9,000,000/year","  Updated 13 Feb 2023, Added 19 Nov 2022 ", FOR RENT: New luxury standard 5bedroom fully detached duplex with bq in a gated Estate.2ye.. Read more ,Furnished,5 beds0 baths0 Toilets
Lekki Lagos,"4,500,000/year","  Updated 13 Feb 2023, Added 30 Jan 2023 ", FOR RENT: To let newly built self-serviced 3 bedroom apartment in an enclosed estate in Le.. Read more ,Newly Built,3 beds3 baths3 Toilets
Lekki Phase 1 Lekki Lagos,"6,000,000/year","  Updated 13 Feb 2023, Added 09 Jan 2023 ", FOR RENT: SERVICED 3 BEDROOM MAISONETTE AVAILABLE FOR RENT IN LEKKI PHASE 1 LEKKI RENT.. Read more ,,3 beds3 baths3 Toilets
Lekki Phase 1 Lekki Lagos,"4,500,000/year","  Updated 13 Feb 2023, Added 10 Jan 2023 ", FOR RENT: Spacious office space at Lekki phrase 1 off Admiralty way Rent #4.5m Agency 10.. Read more ,Furnished, beds baths Toilets
Awoyaya Ajah Lagos,"2,000,000/year","  Updated 13 Feb 2023, Added 28 Dec 2022 ", FOR RENT: Available For Rent!! 3 bedroom bungalow with pent house and a room bq availa.. Read more ,Serviced,3 beds3 baths4 Toilets
Lekki Lagos,"5,000,000/year","  Updated 13 Feb 2023, Added 31 Jan 2023 ", FOR RENT: TO LET 2 BEDROOM APARTMENT Rent: 5million Agent:10% Legal:10% Caution:200k.. Read more ,ServicedNewly Built,2 beds2 baths3 Toilets
Garden Valley Gra Ogudu Lagos,"1,300,000/year","  Updated 13 Feb 2023, Added 27 Jan 2023 ", FOR RENT: A standard room self contain at ogudu garden valley gra Lagos Rent #1.3m slightl.. Read more ,,0 beds0 baths0 Toilets
Lekki Lagos,"6,500,000/year","  Updated 13 Feb 2023, Added 30 Jan 2023 ", FOR RENT: Super Spacious 4-Bedroom Townhouse with BQ Feature!! Brand New 1 Room BQ .. Read more ,ServicedNewly Built,4 beds4 baths5 Toilets
Old Ikoyi Ikoyi Lagos,"10,000,000/year","  Updated 13 Feb 2023, Added 31 Jan 2023 ", FOR RENT: Spacious & Fully Serviced 3 -Bedroom Apartment Feature!! Gym Fitted AC 1.. Read more ,ServicedNewly Built,5 beds4 baths4 Toilets
Lekki Lagos,"4,500,000/year","  Updated 13 Feb 2023, Added 26 Jan 2023 ", FOR RENT: Spacious 3-Bedroom Apartment Features!!! All Rooms En-suite -Spacious Bedr.. Read more ,Serviced,3 beds3 baths4 Toilets
Chevron Lekki Lagos,"2,000,000/year","  Updated 13 Feb 2023, Added 06 Feb 2023 ", FOR RENT: Rent ALART *Well-built standard 3 bedroom flat downstairs in a good and gated e.. Read more ,,3 beds3 baths4 Toilets
Banana Island Ikoyi Lagos,"18,000,000/year","  Updated 13 Feb 2023, Added 07 Jan 2023 ", FOR RENT: FOR RENT : Luxury 5 Bedroom Semi detached house with a room BQ LOCATION: Ba.. Read more ,,5 beds5 baths6 Toilets
Ikate Lekki Lagos,"5,000,000/year","  Updated 13 Feb 2023, Added 07 Feb 2023 ", FOR RENT: Spacious 4 -Bedroom Terrace Feature!! Secure Estate Family Lounge Fitte.. Read more ,Serviced,4 beds4 baths5 Toilets
Infinity Estate Ajah Lagos,"1,800,000/year","  Updated 13 Feb 2023, Added 10 Jan 2023 "," FOR RENT: Modern 2 bedroom terrace duplex available for rent at infinity estate, Ajah. .. Read more ",,2 beds2 baths2 Toilets
Banana Island Ikoyi Lagos,"13,000,000/year","  Updated 13 Feb 2023, Added 26 Jan 2023 ", FOR RENT: Spacious 3-Bedroom Apartment Features!!! -Room BQ -Serviced -First Floor .. Read more ,Serviced,3 beds3 baths4 Toilets
Surulere Lagos,"900,000/year","  Updated 13 Feb 2023, Added 03 Jan 2023 ", FOR RENT: A luxury well finished 1 bedroom flat ( mini flat) upstairs with 2 toilets and p.. Read more ,,0 beds0 baths0 Toilets
Yaba Lagos,"450,000/year","  Updated 13 Feb 2023, Added 28 May 2022 ", FOR RENT: Newly renovated shop space at Yaba Lagos State.. Read more ,Newly Built,0 beds baths Toilets
Old Ikoyi Ikoyi Lagos,"8,500,000/year","  Updated 13 Feb 2023, Added 03 Feb 2023 ", FOR RENT: Very Spacious 3 -Bedroom Terrace Feature!!! Fitted AC 1 Room BQ Swimming .. Read more ,Serviced,3 beds3 baths4 Toilets
Old Ikoyi Ikoyi Lagos,"50,000,000/year","  Updated 13 Feb 2023, Added 07 Feb 2023 ", FOR RENT: Luxury 6 Bedroom Detached House with an Ample Parking Space is now for let In O.. Read more ,,6 beds6 baths7 Toilets
Lekki Lagos,"15,000,000/year","  Updated 13 Feb 2023, Added 12 Jan 2023 "," FOR RENT: FOR LEASE: 6 bedroom semi detached duplex available for rent at Lekki Phase 1, L.. Read more ",,6 beds6 baths6 Toilets
Orchid Estate Ikota Lekki Lagos,"4,000,000/year","  Updated 13 Feb 2023, Added 05 Jan 2023 ", FOR RENT: Newly Built 4 bedroom terrace In an estate Orchid road Rent 4m Agency 400k Le.. Read more ,Newly Built,4 beds4 baths5 Toilets
Egbeda Alimosho Lagos,"2,500,000/year","  Updated 13 Feb 2023, Added 30 Jan 2023 ", FOR RENT: A three bedroom duplex with all rooms en suit full pop wardrobe Italian tiles in.. Read more ,,3 beds3 baths4 Toilets
Ikate Lekki Lagos,"4,500,000/year","  Updated 13 Feb 2023, Added 11 Jan 2023 ", FOR RENT: Clean 2-bedroom Flat Feature!! Modern Fitted Kitchen Spacious Bedrooms .. Read more ,Serviced,2 beds2 baths3 Toilets
Banana Island Ikoyi Lagos,"10,000,000/year","  Updated 13 Feb 2023, Added 09 Feb 2023 ", FOR RENT: Luxury & Well Maintained 3-Bedroom Fully Serviced Apartment Feature!! -Roo.. Read more ,Serviced,3 beds3 baths4 Toilets
Sangotedo Ajah Lagos,"28,000,000/year","  Updated 13 Feb 2023, Added 10 Aug 2022 ", FOR RENT: This property is a Fully Fenced Corner piece plot of land just a few minute's dr.. Read more ,,0 beds0 baths0 Toilets
Victoria Island Lekki Lagos,"15,000,000/year","  Updated 13 Feb 2023, Added 02 Feb 2023 ", FOR RENT: Victoria Island Rentals. Opeyemi Benjamin 888 *3 bedroom flat Features: .. Read more ,Serviced,3 beds3 baths4 Toilets
Mainland Kosofe Kosofe Ikosi Lagos,"1,500,000/year","  Updated 13 Feb 2023, Added 19 Dec 2022 ", FOR RENT: Newly Built 3 Bedroom flat at ikosi kosofe mainland Lagos (1unit remaining) Re.. Read more ,Newly Built,3 beds3 baths3 Toilets
Lekki Lagos,"12,000,000/year","  Updated 13 Feb 2023, Added 31 Jan 2023 ", FOR RENT: Tastefully 5 -Bedroom Detached Duplex Feature!! 1 Room BQ All Rooms En-sui.. Read more ,,5 beds5 baths6 Toilets
Ago Palace Okota Lagos,"800,000/year","  Updated 13 Feb 2023, Added 25 Jan 2023 ", FOR RENT: *LETTING Decent 2 bedroom flat with all room ensuite with dinning off Bayo oyew.. Read more ,,2 beds0 baths0 Toilets
"Off Gbangbala Road, Ikate, Lekki, Lagos (close To Primewater, Freedom Way, Palace) Ikate Lekki Lagos","70,000,000","  Updated 19 Feb 2023, Added 18 Nov 2022 "," FOR SALE: THE CELLO Luxury 2 Bedroom Apartments with a Room BQ, Rooftop Lounge and Gymnas.. Read more",Serviced,2 beds2 baths3 Toilets
Old Ikoyi Ikoyi Lagos,"12,000,000/year","  Updated 13 Feb 2023, Added 07 Feb 2023 ", FOR RENT: Exquisitely Spacious 3-Bedroom Apartment Feature!! Gym Room BQ Fitted AC .. Read more ,Serviced,3 beds3 baths4 Toilets
Lekki Right Hand Side Lekki Lagos,"5,000,000/year","  Updated 13 Feb 2023, Added 15 Jan 2023 "," FOR RENT: *WELL FINISHED & SERVICED 3 BEDROOM FLAT AVAILABLE FOR RENT AT LEKKI RIGHT,LEKK.. Read more ",,3 beds3 baths3 Toilets
Estate Ilaje Ajah Lagos,"1,200,000/year","  Updated 13 Feb 2023, Added 16 Jan 2023 "," FOR RENT: Well Maintained 2 Bedroom Flat located at Ikoyitedo Street, Moba, Ilaje Rent.. Read more ",,2 beds2 baths3 Toilets
Old Ikoyi Ikoyi Lagos,"7,000,000/year","  Updated 13 Feb 2023, Added 31 Jan 2023 ", FOR RENT: Well Maintained & Fully Serviced Water front 3 -Bedroom Apartment Feature!!.. Read more ,ServicedNewly Built,3 beds3 baths4 Toilets
Labak Estate Oko Oba Agege Abule Egba Lagos,"2,000,000/year","  Updated 13 Feb 2023, Added 09 Jan 2023 "," FOR RENT: Decent 4bedroom duplex self compound 5toilets, 4baths, dinning area,all round ti.. Read more ",,4 beds4 baths4 Toilets
