Location,Price_Period,Date_Added_Updated,Description,Serviced,Bed_Bath_Toilet
Chevy View Estate Chevron Lekki Lagos,"1,700,000/year","  Updated 13 Feb 2023, Added 04 Feb 2023 ", FOR RENT: Rent. 1.7M Agency. 170 Legal. 170 Caution. 100 .. Read more ,,1 beds1 baths1 Toilets
Banana Island Ikoyi Lagos,"30,000,000/year","  Updated 13 Feb 2023, Added 13 Jan 2023 ", FOR RENT: Lovely 4-bedroom semi detached house with a BQ located within a serviced estate .. Read more ,,5 beds6 baths6 Toilets
Ogudu Lagos,"1,300,000/year","  Updated 13 Feb 2023, Added 27 Jan 2023 ", FOR RENT: A standard room self contain at ogudu garden valley gra #1.3m slightly negotiabl.. Read more ,,1 beds1 baths1 Toilets
"Harris Drive, Vgc, Lekki Lagos Vgc Lekki Lagos","4,000,000/year","  Updated 13 Feb 2023, Added 19 Dec 2022 ", FOR RENT: 4Bedroom Terrace Duplex Location: Vgc (Harris Drive) Rent: 4Million Ag.. Read more ,ServicedNewly Built,4 beds4 baths4 Toilets
Lekki Lagos,"7,000,000/year","  Updated 13 Feb 2023, Added 10 Feb 2023 ", FOR RENT: Luxury Brand New 4 Bedroom Semi Detached House with Pool and Gym for rent In Lek.. Read more ,ServicedNewly Built,4 beds4 baths5 Toilets
Oniru Victoria Island Lagos,"6,500,000/year","  Updated 13 Feb 2023, Added 07 Feb 2023 "," FOR RENT: SERVICED 3 BEDROOM APARTMENT WITHIN A SERENE NEIGHBOURHOOD Location: VI, Lagos.. Read more ",Serviced,3 beds3 baths4 Toilets
Ado Ajah Lagos,"2,000,000/year","  Updated 13 Feb 2023, Added 31 Jan 2023 ", FOR RENT: Luxury 3 Bedroom Terrace Duplex with a Room BQ all Rooms Ensuite is available fo.. Read more ,,3 beds3 baths4 Toilets
Off Iwaya Road Iwaya Yaba Lagos,"1,200,000/year","  Updated 13 Feb 2023, Added 06 Jan 2023 ", FOR RENT: Rent: N1.2m Agency: 10% Agreement: 10% Caution: N100k.. Read more ,Furnished,2 beds1 baths2 Toilets
Roxbury Estate Ikota Lekki Lagos Ikota Lekki Lagos,"1,300,000/year","  Updated 13 Feb 2023, Added 28 Jan 2023 ", FOR RENT: 24 hours light and security swimming pool gym and children playing area .. Read more ,Serviced,0 beds1 baths1 Toilets
Off Lekki Epe Expressway Ajah Lagos,"1,000,000/year","  Updated 13 Feb 2023, Added 09 Feb 2023 ", FOR RENT: Available For Rent A semi furnished one bedroom (Mini Flat) In university vi.. Read more ,Furnished,1 beds1 baths2 Toilets
"5 Min Drive To Railway Terminal, Aba Opa Area At Alabata Town Moniya Ibadan Oyo","400,000","  Updated 18 Feb 2023, Added 09 Apr 2022 ", FOR SALE: FOR SALE: PLOT OF LAND CLOSE TO IBADAN RAILWAY TERMINAL NO ADDITIONAL PAYMENT.. Read more,, beds baths Toilets
Sangotedo Ajah Lagos,"3,000,000/year","  Updated 13 Feb 2023, Added 07 Feb 2023 ", FOR RENT: Brand new 4 bedroom semi detached duplex with a bq.. Read more ,Newly Built,4 beds5 baths6 Toilets
Victoria Island Lagos,"7,000,000/year","  Updated 13 Feb 2023, Added 11 Feb 2023 "," FOR RENT: 3 BEDROOM APARTMENT FOR RENT !!! Location: VI , Lagos Price: 7m per annum .. Read more ",Serviced,3 beds3 baths4 Toilets
Edun Aboru Iyanapaja Lagos Ipaja Lagos,"500,000/year","  Updated 13 Feb 2023, Added 27 Jan 2023 "," FOR RENT: Letting !!! Tastefully built 2bedroom flat. Features:All round tiles, fenced.. Read more ",,0 beds0 baths0 Toilets
By Chevron Tollgate Lekki Lagos,"5,000,000/year","  Updated 13 Feb 2023, Added 23 Jan 2023 "," FOR RENT: LOVELY 4 BEDROOM SEMI DETACHED DUPLEX WITHIN A MINI ESTATE, Built with class is.. Read more ",Newly Built,4 beds4 baths5 Toilets
Ikota Lekki Lagos,"1,000,000/year","  Updated 13 Feb 2023, Added 05 Feb 2023 ", FOR RENT: Flat / Apartment for rent Ikota Villa Estate Ikota Lekki Lagos Ikota Lekki Lagos.. Read more ,Serviced,0 beds1 baths1 Toilets
Chevron Lekki Lagos,"2,000,000/year","  Updated 13 Feb 2023, Added 25 Jan 2023 "," FOR RENT: Well maintained 1 bedroom (mini flat) at Lekki paradise estate, chevron drive, L.. Read more ",Serviced,1 beds1 baths2 Toilets
Oral Estate Ikota Lekki Lagos,"900,000/year","  Updated 13 Feb 2023, Added 25 Nov 2022 ", FOR RENT: SHARED APARTMENT LETTING @ORAL ESTATE SPACIOUS GUEST ROOM 900K AGENT AND AG.. Read more ,Serviced,0 beds1 baths1 Toilets
Ikota Lekki Lagos,"4,500,000/year","  Updated 13 Feb 2023, Added 04 Jan 2023 "," FOR RENT: FOR RENT 4-BEDROOM DETACHED DUPLEX WITH BQ, POOL WITHIN A SERENE NEIGHBOURHO.. Read more ",,4 beds4 baths5 Toilets
Orchid Lekki Lekki Lagos,"6,500,000/year","  Updated 13 Feb 2023, Added 10 Jan 2023 ", FOR RENT: 5-BEDROOM DETACHED DUPLEX FOR RENT Amenities: - Fitted Kitchen - POP Ce.. Read more ,,5 beds5 baths6 Toilets
Lekki Lagos,"13,000,000/year","  Updated 13 Feb 2023, Added 03 Feb 2023 ", FOR RENT: *MASSIVE 5 BEDROOM DUPLEX WITH 2 ROOM BQ AVAILABLE TO LET (self serviced) LOC.. Read more ,,5 beds6 baths6 Toilets
Isheri North Ojodu Lagos,"1,800,000/year","  Updated 13 Feb 2023, Added 26 Jan 2023 ", FOR RENT: ISHERI NORTH LETTING: 1) Newly Built and nicely finished 3 bedroom flat ensuite.. Read more ,Newly Built,3 beds3 baths4 Toilets
Bishop Aboyade Cole Ademola Adetokunbo Victoria Island Lagos,"35,000,000/year","  Updated 13 Feb 2023, Added 21 Jan 2023 ", FOR RENT: FOR LEASE COMMERCIAL BUILDING ON BISHOP ABOYADE COLE STREET VICTORIA ISLAND L.. Read more ,, beds0 baths0 Toilets
Ikoyi Lagos,"24,000,000/year","  Updated 13 Feb 2023, Added 05 Jan 2023 ", FOR RENT: A 2-story building Consisting of over 17 rooms office space to let along a busy .. Read more ,, beds0 baths0 Toilets
Area 1 Estate Abulegba Abule Egba Lagos,"36,000/year","  Updated 13 Feb 2023, Added 10 Feb 2023 ", FOR RENT: A room with water separate toilet and bathroom At Area 1 Abulegba Price:36k R.. Read more ,Serviced,1 beds1 baths1 Toilets
Ikate Lekki Lagos,"6,000,000/year","  Updated 13 Feb 2023, Added 11 Feb 2023 ", FOR RENT: Rent 6m Agency 10% Agreement 10% Caution 10% Dickson the man .. Read more ,Serviced,0 beds0 baths0 Toilets
Chevron Lekki Lagos,"2,500,000/year","  Updated 13 Feb 2023, Added 15 Jan 2023 ", FOR RENT: TO LET SELF SERVICED 2 & 3 BEDROOM APARTMENT WITHIN A SERENE NEIGHBORHOOD L.. Read more ,,2 beds2 baths3 Toilets
Adeola Odeku Victoria Island Lagos,"2,000,000/year","  Updated 13 Feb 2023, Added 31 Jan 2023 ", FOR RENT: 24hrs Power Fully Furnished & Serviced 1 Bedroom Studio Apartment with Swimming .. Read more ,FurnishedServiced,1 beds1 baths1 Toilets
Off Luth Road Mushin Lagos,"200,000/year","  Updated 13 Feb 2023, Added 28 May 2022 ", FOR RENT: Fastest fingers only: A lovely room self contained an apartment in a Serene envi.. Read more ,,0 beds0 baths0 Toilets
Off Sipeolu Palmgroove Shomolu Lagos,"450,000/year","  Updated 13 Feb 2023, Added 18 Nov 2022 ", FOR RENT: A fantastic brand new modern self contain apartment in a serene environment at P.. Read more ,Newly Built,0 beds0 baths0 Toilets
Off Luth Road Mushin Lagos,"300,000/year","  Updated 13 Feb 2023, Added 04 Jul 2022 ", FOR RENT: Fastest fingers only: A nice and spacious room self-contained apartment in a sec.. Read more ,,0 beds0 baths0 Toilets
Oke Afa Isolo Lagos,"400,000,000","  Updated 19 Feb 2023, Added 08 Feb 2023 ", FOR SALE: *FILLING STATION* FOR sale @ *OKE AFA* ISOLO Ejigbo rd On *3 plots* .. Read more,,0 beds0 baths0 Toilets
Idi Araba Surulere Lagos,"800,000/year","  Updated 13 Feb 2023, Added 06 Feb 2023 ", FOR RENT: Fastest fingers only: A fantastic brand new modern 2 bedroom flat apartment all .. Read more ,Newly Built,2 beds3 baths3 Toilets
Alagomeji Yaba Alagomeji Yaba Lagos,"850,000/year","  Updated 13 Feb 2023, Added 28 Jan 2023 ", FOR RENT: Decent renovated potable mini flat @Alagomeji yaba rent 850k .. Read more ,Newly Built,1 beds1 baths1 Toilets
Ilaje Ajah Lagos,"1,500,000/year","  Updated 13 Feb 2023, Added 31 Jan 2023 ", FOR RENT: Clean Standard 2 Bedroom Apartment Rent: N1.5M Agency: 10% Legal: 10% Caut.. Read more ,,2 beds2 baths3 Toilets
Jebba By Herbert Macaulay Way Ebute Metta Yaba Lagos,"600,000/year","  Updated 13 Feb 2023, Added 02 Feb 2023 ", FOR RENT: Rent #600k..2yrs required Agreement & Agency fees inclusive .. Read more ,Furnished,1 beds1 baths1 Toilets
Chevron Alternative Road Lekki Lagos Chevron Lekki Lagos,"1,100,000/year","  Updated 13 Feb 2023, Added 28 Jan 2023 ", FOR RENT: Flat / Apartment for rent Chevron Alternative Road Lekki Lagos chevron Lekki Lag.. Read more ,Serviced,0 beds1 baths1 Toilets
"Oral Extension, Eleganza Bustop Lekki Lagos","1,300,000/year","  Updated 13 Feb 2023, Added 12 Jan 2023 ", FOR RENT: Rent 1.3 Service charge 200K.. Read more ,,0 beds1 baths1 Toilets
Bariga Shomolu Lagos,"1,300,000/year","  Updated 13 Feb 2023, Added 01 Feb 2023 "," FOR RENT: An Executive Brand Newly Built Ensuites Modern 2 bedroom Flat @ Ladi Lak, Shomol.. Read more ",ServicedNewly Built,2 beds3 baths3 Toilets
Luggard Avenue Ikoyi Lagos,"65,000,000/year","  Updated 13 Feb 2023, Added 12 Feb 2023 "," FOR RENT: LAND FOR LEASE ON LUGGARD ROAD IKOYI LAGOS 2,100sqm of land Purpose of use.. Read more ",,0 beds0 baths0 Toilets
Ogudu Lagos,"900,000/year","  Updated 13 Feb 2023, Added 07 Feb 2023 ", FOR RENT: Newly built mini flat in ogudu orioke with guest toilet gated with car space... Read more ,Newly Built,1 beds2 baths2 Toilets
Banana Island Lekki Lagos,"10,000,000/year","  Updated 13 Feb 2023, Added 11 Feb 2023 "," FOR RENT: FULLY FURNISHED 3 BEDROOM APARTMENT FOR RENT !!! Location: Banana Island, Lag.. Read more ",FurnishedServiced,3 beds3 baths4 Toilets
Akoka Akoka Yaba Lagos,"400,000/year","  Updated 13 Feb 2023, Added 13 Aug 2022 ", FOR RENT: Fastest fingers only: A nice and spacious room self contain apartment in a Seren.. Read more ,,0 beds0 baths0 Toilets
Fola Agoro Fola Agoro Yaba Lagos,"600,000/year","  Updated 13 Feb 2023, Added 31 Jul 2022 ", FOR RENT: Fastest fingers only: An executive spacious room self contain apartment in a Ser.. Read more ,Newly Built,0 beds0 baths0 Toilets
Luth Road Mushin Mushin Lagos,"200,000/year","  Updated 13 Feb 2023, Added 20 Jul 2022 ", FOR RENT: Fastest fingers only: A very spacious shop with big frontage off Luth Road in a.. Read more ,Newly Built,0 beds0 baths0 Toilets
Olateju Mushin Lagos,"240,000/year","  Updated 13 Feb 2023, Added 04 Jul 2022 ", FOR RENT: Fastest fingers only: A very spacious shop with a big frontage in a strategic lo.. Read more ,Serviced,0 beds0 baths0 Toilets
Pedro Gbagada Palmgroove Shomolu Lagos,"350,000/year","  Updated 13 Feb 2023, Added 04 Jul 2022 ", FOR RENT: Fastest fingers only: A brand new modern room self contain apartment with pop fi.. Read more ,FurnishedNewly Built,0 beds0 baths0 Toilets
Obanikoro Obanikoro Shomolu Lagos,"350,000/year","  Updated 13 Feb 2023, Added 11 Jun 2022 ", FOR RENT: A nice and spacious room self contain apartment at Obanikoro with necessary faci.. Read more ,,0 beds0 baths0 Toilets
Palmgroove Palmgroove Shomolu Lagos,"500,000/year","  Updated 13 Feb 2023, Added 03 Jun 2022 "," FOR RENT: fastest finger decent room self con at palmgroove with pop,screeded wall,kitch.. Read more ",FurnishedNewly Built,0 beds0 baths0 Toilets
Off Isolo Road Mushin Lagos,"1,200,000/year","  Updated 13 Feb 2023, Added 28 May 2022 ", FOR RENT: Fastest fingers only: A mini-warehouse with big frontage and inbuilt off Isolo .. Read more ,FurnishedNewly Built,0 beds0 baths0 Toilets
Jibowu Jibowu Yaba Lagos,"500,000/year","  Updated 13 Feb 2023, Added 20 May 2022 ", FOR RENT: Fastest fingers only: A spacious brand new modern room self contain apartment in.. Read more ,Newly Built,0 beds0 baths0 Toilets
Onipanu/kayode Ikorodu Road(ilupeju) Ilupeju Lagos,"300,000/year","  Updated 13 Feb 2023, Added 27 Apr 2022 "," FOR RENT: Fastest fingers only: A Big Shop with Big Frontage, store, and inbuilt toilet wa.. Read more ",,0 beds0 baths0 Toilets
Kilo Kilo Marsha Surulere Lagos,"600,000/year","  Updated 13 Feb 2023, Added 27 Apr 2022 ", FOR RENT: Fastest fingers only: A nice room self contain apartment in a Serene environment.. Read more ,,0 beds0 baths0 Toilets
Palmgroove Palmgroove Shomolu Lagos,"550,000/year","  Updated 13 Feb 2023, Added 27 Apr 2022 ", FOR RENT: Fastest fingers only: A fantastic modern room self contain an apartment in a Ser.. Read more ,Furnished,0 beds0 baths0 Toilets
Palmgroove Shomolu Lagos,"550,000/year","  Updated 13 Feb 2023, Added 10 Feb 2023 ", FOR RENT: STANDARD ROOM SELF CONTAIN AT PEDRO CLOSE TO CHARLEY BOY WITH POP SCREEDED WALL .. Read more ,Newly Built,0 beds0 baths0 Toilets
Fola Agoro Yaba Lagos,"1,000,000/year","  Updated 13 Feb 2023, Added 07 Feb 2023 "," FOR RENT: EXECUTIVE STANDARD MINI FLAT AT FOLAGORO ROAD IN A GATED COMPOUND,WITH POP, SCRE.. Read more ",Newly Built,1 beds2 baths2 Toilets
Off Adebola Ojomu Aguda Surulere Lagos,"2,500,000/year","  Updated 13 Feb 2023, Added 23 Jan 2023 ", FOR RENT: *Just out now* TO-LET. Exquisitely finished modern massive Newly built 6unit.. Read more ,Newly Built,3 beds3 baths4 Toilets
Shomolu Lagos,"1,500,000/year","  Updated 13 Feb 2023, Added 21 Jan 2023 "," FOR RENT: Newly built standard 2bedroom flat both room en-suite with guest toilet, car pac.. Read more ",Newly Built,2 beds2 baths3 Toilets
Idi Araba Surulere Lagos,"600,000/year","  Updated 13 Feb 2023, Added 06 Feb 2023 ", FOR RENT: AWOOF LETTING AN EXECUTIVE MINI FLAT VERY SPACIOUS WITH MODERN FINISHING ALL RO.. Read more ,Newly Built,1 beds0 baths0 Toilets
Ikorodu Road Shomolu Lagos,"1,500,000/year","  Updated 13 Feb 2023, Added 30 Jan 2023 ", FOR RENT: Fastest fingers only: A fantastic brand new modern 2 bedroom flat apartment in a.. Read more ,Newly Built,2 beds3 baths3 Toilets
Soluyi Gbagada Lagos,"2,000,000/year","  Updated 13 Feb 2023, Added 08 Feb 2023 ", FOR RENT: Decent 3 bedroom flat In a very calm and conducive part of Gbagada Location So.. Read more ,,3 beds3 baths3 Toilets
Freedom Way Lekki Lagos,"5,500,000/year","  Updated 13 Feb 2023, Added 22 Jan 2023 "," FOR RENT: Executive furnished 3 bedrooms apartment, at LSDPC housing Estate, Freedom way, .. Read more ",Furnished,3 beds3 baths4 Toilets
Akoka Yaba Lagos,"1,500,000/year","  Updated 13 Feb 2023, Added 09 Jan 2023 ", FOR RENT: EXECUTIVE Spacious and Nice 3 Bedroom duplex with 3 Toilet and 3Baths... Read more ,,3 beds3 baths3 Toilets
Palmgroove Shomolu Lagos,"800,000/year","  Updated 13 Feb 2023, Added 09 Jan 2023 "," FOR RENT: A Newly built Miniflat with wardrobe, kitchen cabinets and water heater in palmg.. Read more ",,1 beds1 baths1 Toilets
Pedro Palmgroove Shomolu Lagos,"1,200,000/year","  Updated 13 Feb 2023, Added 15 Dec 2022 "," FOR RENT: TO LET 3-BEDROOM FLAT AT PEDRO RD. PEDRO. 2-TOILET 2BATH ALL TILED, WATER.. Read more ",,3 beds2 baths2 Toilets
Ikeja Gra Ikeja Lagos,"10,000,000/year","  Updated 13 Feb 2023, Added 28 Jan 2023 "," FOR RENT: Standard lovely 4 bed room duplex with a room BQ pop, prepare meter very secured.. Read more ",Newly Built,4 beds4 baths5 Toilets
Off Ilaje Akoka Yaba Lagos,"400,000/year","  Updated 13 Feb 2023, Added 29 Jan 2023 ", FOR RENT: Fastest fingers only: A fantastic brand new modern self contain apartment in a n.. Read more ,Newly Built,0 beds0 baths0 Toilets
Palmgroove Shomolu Lagos,"1,200,000/year","  Updated 13 Feb 2023, Added 10 Feb 2023 ", FOR RENT: Just out for let now Fastest finger EXECUTIVE 3 BEDROOM FLAT AT PEDRO RD. AWOF.. Read more ,,3 beds2 baths2 Toilets
Alagomeji Yaba Lagos,"1,200,000/year","  Updated 13 Feb 2023, Added 27 Jan 2023 "," FOR RENT: Newly built mini lovely mini flat with pop, prepare meter in a nice and secured .. Read more ",Newly Built,1 beds1 baths1 Toilets
Ikorodu Road(ilupeju) Ilupeju Lagos,"800,000/year","  Updated 13 Feb 2023, Added 09 Feb 2023 ", FOR RENT: Fastest fingers only: A mini warehouse house at Ikorodu road Fadeyi .. Read more ,,0 beds0 baths0 Toilets
Ikorodu Road(ilupeju) Ilupeju Lagos,"1,500,000/year","  Updated 13 Feb 2023, Added 07 Feb 2023 ", FOR RENT: Fastest fingers only: A fantastic brand new modern 2 bedroom flat apartment in a.. Read more ,ServicedNewly Built,2 beds3 baths3 Toilets
Jibowu Yaba Lagos,"700,000/year","  Updated 13 Feb 2023, Added 05 Feb 2023 ", FOR RENT: A nice mini flat apartment in a nice and secure environment at Jibowu Yaba with .. Read more ,,1 beds1 baths1 Toilets
Phase 2 Gbagada Lagos,"3,000,000/year","  Updated 13 Feb 2023, Added 03 Feb 2023 ", FOR RENT: A Modern 3 bedroom semi-detached duplex (self compound all ensuite with family l.. Read more ,,3 beds4 baths4 Toilets
Fola Agoro Yaba Lagos,"1,000,000/year","  Updated 13 Feb 2023, Added 07 Feb 2023 ", FOR RENT: DIRECT BRIEF EXECUTIVE STANDARD MINI FLAT AT FOLAGORO ROAD IN A GATED COMPOUND.. Read more ,,1 beds1 baths2 Toilets
Bariga Shomolu Shomolu Lagos,"400,000/year","  Updated 13 Feb 2023, Added 21 Oct 2022 "," FOR RENT: Fastest fingers only: Excutive super decent n standard self con with pop, Scr.. Read more ",Newly Built,0 beds0 baths0 Toilets
Bariga Shomolu Lagos,"200,000/year","  Updated 13 Feb 2023, Added 17 Oct 2022 ", FOR RENT: Fastest fingers only: A nice self contain apartment in a nice environment at Bar.. Read more ,,0 beds0 baths0 Toilets
Bariga Bariga Shomolu Lagos,"400,000/year","  Updated 13 Feb 2023, Added 05 Oct 2022 ", FOR RENT: Fastest fingers only: A fantastic modern brand new self contain apartment in a n.. Read more ,Newly Built,0 beds0 baths0 Toilets
Onike Yaba Lagos,"500,000/year","  Updated 13 Feb 2023, Added 15 Sep 2022 ", FOR RENT: A nice self contain apartment in a nice environment at Onike Yaba with necessary.. Read more ,,0 beds0 baths0 Toilets
Ilupeju Lagos,"2,800,000/year","  Updated 13 Feb 2023, Added 18 Jan 2023 ", FOR RENT: Fastest fingers only 4 4 bedroom terrace duplex all ensuite with each room hav.. Read more ,,4 beds5 baths5 Toilets
Fola Agoro Yaba Lagos,"1,200,000/year","  Updated 13 Feb 2023, Added 18 Jan 2023 ", FOR RENT: FASTEST FINGERS ONLY DIRECT BRIEF STANDARD 2 BEDROOM FLAT AT YABA OFF FOLA AGOR.. Read more ,Newly Built,2 beds3 baths3 Toilets
Off Pedro Gbagada Extension Palmgroove Shomolu Lagos,"1,200,000/year","  Updated 13 Feb 2023, Added 31 Dec 2022 ", FOR RENT: *FRESH LETTING *EXECUTIVE AND SPACIOUS TWO(2)BEDROOM FLAT OFF PEDRO RD. PAL.. Read more ,,2 beds3 baths3 Toilets
Fadeyi Ikorodu Road(ilupeju) Ilupeju Lagos,"1,200,000/year","  Updated 13 Feb 2023, Added 13 Dec 2022 ", FOR RENT: Fastest fingers only Just out 2 bedroom apartments at fadeyi with all rooms en.. Read more ,Newly Built,2 beds3 baths3 Toilets
Onipanu Shomolu Lagos,"250,000/year","  Updated 13 Feb 2023, Added 18 Jan 2023 ", FOR RENT: Just out for let now Fastest finger Room self contain in shomolu with necess.. Read more ,,0 beds0 baths0 Toilets
Fola Agoro Yaba Lagos,"500,000/year","  Updated 13 Feb 2023, Added 18 Jan 2023 ", FOR RENT: STANDARD ROOM SELF CONTAIN AT FOLAGORO EMMANUEL KOLAWOLE STREET.. Read more ,,0 beds0 baths0 Toilets
Alapere Kosofe Ikosi Lagos,"400,000/year","  Updated 13 Feb 2023, Added 03 Feb 2023 "," FOR RENT: A lovely room self contain with pop finishing, fitted kitchen cabinet, Chanderla.. Read more ",,1 beds1 baths1 Toilets
Off Apata Onipanu Shomolu Lagos,"400,000/year","  Updated 13 Feb 2023, Added 05 Oct 2022 ", FOR RENT: DON'T SLEEP WAKE UP DON'T MISS IT Very spacious Room selfcon fence round a.. Read more ,,0 beds0 baths0 Toilets
Onike Iwaya Yaba Lagos,"3,000,000/year","  Updated 13 Feb 2023, Added 18 Dec 2022 ", FOR RENT: Neatly used standard 4bed room fully detached duplex all rooms ensuit with a roo.. Read more ,Newly Built,4 beds4 baths4 Toilets
Medina Estate Gbagada Lagos,"1,800,000/year","  Updated 13 Feb 2023, Added 11 Jan 2023 ", FOR RENT: A Relatively new 2 bedroom up n ground flats both rooms ensuite with guest toile.. Read more ,Newly Built,2 beds2 baths3 Toilets
Millenuim Ups Gbagada Lagos,"2,500,000/year","  Updated 13 Feb 2023, Added 27 Jan 2023 "," FOR RENT: 4 units of 3 bedroom with 3t 2b all tiled,with kitchen cabinet, wardrobes n prep.. Read more ",,3 beds3 baths3 Toilets
Bariga Shomolu Lagos,"450,000/year","  Updated 13 Feb 2023, Added 30 Jan 2023 ", FOR RENT: Fastest fingers only: A fantastic brand new modern self contain apartment in a n.. Read more ,Newly Built,0 beds0 baths0 Toilets
Ikorodu Road(ilupeju) Ilupeju Lagos,"400,000/year","  Updated 13 Feb 2023, Added 06 Feb 2023 ", FOR RENT: A fantastic brand new modern self contain apartment at Ilupeju with necessary mo.. Read more ,Newly Built,0 beds0 baths0 Toilets
Off Kilo Bus Stop Surulere Lagos Kilo Marsha Surulere Lagos,"1,000,000/year","  Updated 13 Feb 2023, Added 27 Jan 2023 ", FOR RENT: Nice and Spacious 3 bedroom flat upstairs for rent in Surulere with all round ti.. Read more ,,3 beds1 baths1 Toilets
Marshy Hills Estate Ajah Lagos,"850,000/year","  Updated 13 Feb 2023, Added 17 Jan 2023 "," FOR RENT: Newly built 1-Bedroom mini flat available for rent at Marshy Hills estate, off .. Read more ",FurnishedServicedNewly Built,1 beds1 baths1 Toilets
Agungi Lekki Lagos,"800,000/year","  Updated 13 Feb 2023, Added 06 Feb 2023 "," FOR RENT: Self Contained BQ Rent with open plan kitchen at John Okafor estate, Agungi. Re.. Read more ",,1 beds1 baths1 Toilets
Ikeja Lagos,"9,000,000/year","  Updated 13 Feb 2023, Added 07 Feb 2023 ", FOR RENT: SPACIOUS 4 BEDROOM DETACHED DUPLEX WITHIN A ESTATE!!! ( Suitable for both reside.. Read more ,,4 beds4 baths5 Toilets
Banana Island Ikoyi Lagos,"12,000,000/year","  Updated 13 Feb 2023, Added 18 Jan 2023 ", FOR RENT: Luxury 3-Bedroom apartment with a BQ located within a mini-estate in banana isla.. Read more ,Serviced,3 beds4 baths4 Toilets
Aromire Allen Avenue Ikeja Lagos,"12,000,000/year","  Updated 13 Feb 2023, Added 01 Oct 2022 ", FOR RENT: Strategically placed...... Read more ,,0 beds0 baths0 Toilets
Ogudu Lagos,"1,400,000/year","  Updated 13 Feb 2023, Added 11 Feb 2023 ", FOR RENT: Specious 2bedroom flat in ogudu orioke upstairs with all rooms ensuit guest toil.. Read more ,,2 beds3 baths3 Toilets
Ogudu Lagos,"2,000,000/year","  Updated 13 Feb 2023, Added 18 Jan 2023 ", FOR RENT: Newly built 2 bedroom in ogudu orioke in an estate with all rooms ensuit guest t.. Read more ,Newly Built,2 beds3 baths3 Toilets
Opebi Ikeja Lagos,"2,300,000/year","  Updated 13 Feb 2023, Added 27 Jan 2023 ", FOR RENT: Standard 2 bedroom ground floor in serene close in OPEBI ikeja:2.3M semi-direct .. Read more ,,2 beds3 baths3 Toilets
Jibowu Yaba Lagos,"250,000/year","  Updated 13 Feb 2023, Added 03 Aug 2022 ", FOR RENT: Fastest fingers only: A nice self contain apartment in a Serene environment at J.. Read more ,,0 beds0 baths0 Toilets
Vgc Lekki Lagos,"3,000,000/year","  Updated 13 Feb 2023, Added 18 Jan 2023 "," FOR RENT: Sharp 2 bedroom terrace duplex in a proposed service court, White oak estate, Ha.. Read more ",ServicedNewly Built,2 beds2 baths3 Toilets
Aguda Surulere Lagos,"2,500,000/year","  Updated 13 Feb 2023, Added 15 Dec 2022 ", FOR RENT: STILL AVAILABLE TOLET. FOR YOUR DIRECT CLIENT ONLY. A SUPERB NEWLY BUILT .. Read more ,Newly Built,3 beds4 baths4 Toilets
Palmgroove Ikorodu Road(ilupeju) Ilupeju Lagos,"300,000/year","  Updated 13 Feb 2023, Added 29 Jan 2023 ", FOR RENT: Fastest fingers only: A fantastic brand new modern self contain apartment in a s.. Read more ,Newly Built,0 beds0 baths0 Toilets
Morocco Shomolu Shomolu Lagos,"1,000,000/year","  Updated 13 Feb 2023, Added 27 Jan 2023 "," FOR RENT: Newly built mini lovely mini flat with pop, prepare meter in a nice and secured .. Read more ",Newly Built,1 beds1 baths1 Toilets
Alagomeji Yaba Lagos,"1,300,000/year","  Updated 13 Feb 2023, Added 02 Feb 2023 "," FOR RENT: Two bedroom flat at Alagomeji,2t2b. Rent-1.3M... Read more ",Furnished,2 beds2 baths2 Toilets
Shomolu Lagos,"1,500,000/year","  Updated 13 Feb 2023, Added 24 Jan 2023 "," FOR RENT: Standard 2 bedroom flat both rooms en-suite with guest toilet, pop, upstairs, pe.. Read more ",,2 beds2 baths3 Toilets
"Grace Court, Orchid Road Eleganza Bustop Lekki Lagos Lekki Lagos","1,400,000/year","  Updated 13 Feb 2023, Added 27 Jan 2023 ", FOR RENT: 1: PARLOUR SPACE STUDIO WITH OPEN PLAN KITCHEN: 1.4M. *LOCATION: GRACE COURT.. Read more ,,0 beds1 baths1 Toilets
Peace Estate Command. Ipaja Lagos,"400,000/year","  Updated 13 Feb 2023, Added 12 Jan 2023 ", FOR RENT: To Let Affordable decent 2 bedroom Flat Fence Gate Water All round tiles .. Read more ,,0 beds0 baths0 Toilets
Mangoro Ikeja Lagos,"1,200,000/year","  Updated 13 Feb 2023, Added 10 Feb 2023 ", FOR RENT: Nice standard executive 2bedroom in a good location of mongoro beside Ikeja.newl.. Read more ,,2 beds0 baths0 Toilets
Off Ilaje Akoka Yaba Lagos,"550,000/year","  Updated 13 Feb 2023, Added 29 Jan 2023 ", FOR RENT: Fastest fingers only: A fantastic brand new modern portable mini flat apartment .. Read more ,Newly Built,1 beds1 baths1 Toilets
Abule Ijesha Yaba Lagos,"900,000/year","  Updated 13 Feb 2023, Added 11 Jan 2023 ", FOR RENT: nice 2 bedroom flat apartment in a serene environment at Yaba with costant elect.. Read more ,,2 beds2 baths2 Toilets
Abule Ijesha Yaba Lagos,"350,000/year","  Updated 13 Feb 2023, Added 24 Nov 2022 ", FOR RENT: A clean self contain apartment in a nice environment at Abule Ijesha Yaba with c.. Read more ,,0 beds0 baths0 Toilets
Idado Estate Lekki Lagos,"3,000,000/year","  Updated 13 Feb 2023, Added 19 Jan 2023 ", FOR RENT: SERVICED 3BEDROOM APARTMENT WITHIN A SERENE NEIGHBORHOOD. This serviced apart.. Read more ,Serviced,3 beds3 baths4 Toilets
Aboru Ipaja Lagos,"5,000/month","  Updated 13 Feb 2023, Added 05 Jan 2023 ", FOR RENT: Shop to let ! Very big affordable shop to let. Location :Unity road Aboru Iy.. Read more ,,0 beds0 baths0 Toilets
Lekki Phase 1 Lekki Lagos,"12,600,000/year","  Updated 13 Feb 2023, Added 24 May 2022 ", FOR RENT: Exquisite Open Plan Office Space for Rent in the heart of Lekki Phase 1 Rent .. Read more ,ServicedNewly Built,0 beds0 baths0 Toilets
Off Herbert Macaulay Way Adekunle Yaba Lagos,"150,000/year","  Updated 13 Feb 2023, Added 23 Sep 2022 ", FOR RENT: Rent N150k Agreement: N75k Agency: N75k.. Read more ,Newly Built,0 beds0 baths0 Toilets
Banana Island Ikoyi Lagos,"30,000,000/year","  Updated 13 Feb 2023, Added 12 Dec 2022 ", FOR RENT: 4 BEDROOM LUXURY DETACHED HOUSE with Luxury finishing. Features!!! -All Room.. Read more ,Serviced,4 beds4 baths5 Toilets
