Location,Price_Period,Date_Added_Updated,Description,Serviced,Bed_Bath_Toilet
Onike Yaba Lagos,"3,000,000/year","  Updated 20 Jan 2023, Added 09 Jan 2023 ", FOR RENT: TO LET Luxuriously built 3-bedroom flat with BQ in a serene and secured esta.. Read more ,ServicedNewly Built,3 beds4 baths4 Toilets
Akoka Yaba Lagos,"600,000/year","  Updated 20 Jan 2023, Added 01 Aug 2022 ", FOR RENT: Newly Built Self Contain Apartment in a Serene Neighborhood For Rent. Feature.. Read more ,Newly Built,0 beds1 baths1 Toilets
Akoka Yaba Lagos,"600,000/year","  Updated 20 Jan 2023, Added 24 Dec 2022 ", FOR RENT: Newly Built and Spacious Self-Con apartment in a serene environment of Akoka fea.. Read more ,Newly Built, beds1 baths1 Toilets
Lekki Phase 1 Lekki Lagos,"7,000,000/year","  Updated 20 Jan 2023, Added 19 Aug 2022 ", FOR RENT: Luxury 4bedroom terrace duplex with bq at lekki phase 1 Rent 8m Service ch.. Read more ,, beds baths Toilets
Aguda Surulere Lagos,"2,500,000/year","  Updated 20 Jan 2023, Added 13 Jan 2023 ", FOR RENT: A lovely and nice well finished newly built 3bedroom flat in surulere aguda aiye.. Read more ,Newly Built,3 beds3 baths4 Toilets
Vgc Lekki Lagos,"4,000,000/year","  Updated 20 Jan 2023, Added 18 Dec 2022 ", FOR RENT: Other charges: - Agency 10% - Legal. 10% - Caution 300k - Service charge :.. Read more ,,4 beds0 baths0 Toilets
Oshodi Lagos,"2,000/sqm","  Updated 20 Jan 2023, Added 13 Jul 2022 "," FOR RENT: *_just 6 Months rent_ WAREHOUSE along OSHODI APAPA 17,500ft2 x N2000÷6 di.. Read more ",,0 beds0 baths0 Toilets
Divine Homes Estate Thomas Estate Ajah Lagos,"3,500,000/year","  Updated 20 Jan 2023, Added 09 Jan 2023 ", FOR RENT: Brand new 4 bedroom detached house in a mini estate inside in Divine homes estat.. Read more ,Newly Built,4 beds4 baths5 Toilets
Lekki Phase 1 Lekki Lagos,"8,000,000/year","  Updated 20 Jan 2023, Added 11 Aug 2022 "," FOR RENT: Furnished 6 Bedrooms Detached Duplex with BQ For Rent Price: 8,000,000 Agenc.. Read more ",FurnishedNewly Built,0 beds0 baths0 Toilets
Ajao Estate Airport Road Oshodi Lagos,"15,000,000/year","  Updated 20 Jan 2023, Added 09 Jan 2023 ", FOR RENT: Commercial Property for rent Ajao Estate Airport Road Oshodi Lagos.. Read more ,,0 beds0 baths0 Toilets
Ocean Breeze Estate Ologolo Lekki Lagos,"2,700,000/year","  Updated 20 Jan 2023, Added 09 Jan 2023 ", FOR RENT: Brand new well finished apartment .. Read more ,ServicedNewly Built,2 beds2 baths3 Toilets
Magodo Gra Phase 1 Ojodu Lagos,"2,000,000/year","  Updated 20 Jan 2023, Added 29 Dec 2022 ", FOR RENT: 3 bedroom flat for rent at magodo phase 1 inside an Estate upstairs just 3 occup.. Read more ,,3 beds3 baths3 Toilets
"Harmony Villas Estate, Off Channels Tv Road Isheri North Ojodu Lagos","1,000,000/year","  Updated 20 Jan 2023, Added 16 Dec 2022 ", FOR RENT: 3 bedroom flat Master's bedroom en-suite Kitchen cabinets Secured and serene.. Read more ,,3 beds0 baths0 Toilets
Ikota Lekki Lagos,"2,500,000/year","  Updated 20 Jan 2023, Added 06 Jan 2023 "," FOR RENT: Brand new fully serviced 2 and 3 bedroom apartments with swimming pool, gym, 24 .. Read more ",Newly Built,2 beds2 baths3 Toilets
Ogudu Gra Ogudu Lagos,"6,000,000/year","  Updated 20 Jan 2023, Added 19 Dec 2022 ", FOR RENT: FOR RENT 4 BEDROOM FULLY DETACHED DUPLEX WITH ONE BQ in a very secure and ser.. Read more ,,4 beds4 baths5 Toilets
Lekki Gardens Phase 2 By Abraham Adesanya Lekki Gardens Estate Ajah Lagos,"3,000,000/year","  Updated 20 Jan 2023, Added 24 Dec 2022 ", FOR RENT: A party serviced 4 bedroom semi detached duplex with bq and anti room. 2 balconi.. Read more ,Serviced,4 beds4 baths5 Toilets
Isheri North Ojodu Lagos,"1,200,000/year","  Updated 20 Jan 2023, Added 13 Jan 2023 ", FOR RENT: This property is situated at Isheri North GRA Opic Channels TV road Lagos Ibadan.. Read more ,Newly Built,3 beds3 baths4 Toilets
Adeniran Ogunsanya Surulere Lagos,"2,000,000/year","  Updated 20 Jan 2023, Added 11 Jan 2023 "," FOR RENT: A very nice and spacious shop on adeniran ogunsanya road with inbuilt toilet, ti.. Read more ",,0 beds0 baths Toilets
Lekki Lagos,"12,000,000/year","  Updated 20 Jan 2023, Added 09 Nov 2022 ", FOR RENT: FEATURES: -KVA Generator -Self compound -Fitted Kitchen with refrigerator -W.. Read more ,,0 beds0 baths0 Toilets
Victoria Island Lagos,"50,000/sqm","  Updated 20 Jan 2023, Added 14 Sep 2022 ", FOR RENT: Highly Viable Showroom of 501.47sqm on a corner piece at a business-viable Locat.. Read more ,Serviced,0 beds0 baths0 Toilets
New Garage Gbagada Lagos,"1,600,000/year","  Updated 20 Jan 2023, Added 29 Dec 2022 ", FOR RENT: Relatively new 2 bedroom up flat both rooms ensuite with guest toilet all tiled .. Read more ,Newly Built,2 beds2 baths3 Toilets
Morrison Cresent Alausa Ikeja Lagos,"20,000/sqm","  Updated 20 Jan 2023, Added 26 May 2022 "," FOR RENT: Warehouse for lease 1000sqm self compound warehouse space at Morrison crescent,.. Read more ",,0 beds0 baths0 Toilets
Lekki Lagos,"350,000,000","  Updated 19 Feb 2023, Added 15 Dec 2022 "," FOR SALE: 5 Bedroom Detached Duplex with Bq Location: Lekki Phase 1, Lekki Lagos. F.. Read more",Newly Built,5 beds5 baths5 Toilets
Adekunle Yaba Lagos,"1,200,000/year","  Updated 20 Jan 2023, Added 15 Jan 2023 "," FOR RENT: A lovely and nice good 2 bedroom flat with all round tiles, all rooms ensuite, v.. Read more ",,2 beds2 baths3 Toilets
Ikate Lekki Lagos,"13,000,000/year","  Updated 20 Jan 2023, Added 19 Dec 2022 ", FOR RENT: MASSIVE 5 BEDROOM FULLY DETACHED SMART DUPLEX WITHIN A MINI ESTATE RENT: N13M.. Read more ,,5 beds0 baths0 Toilets
"Peace Land Estate Phase 2, Giwa Busstop Iju Ishaga Agege Lagos","800,000/year","  Updated 20 Jan 2023, Added 07 Jan 2023 ", FOR RENT: To Let..... --- Brand new house consisting of mini flat and 2bedroom flat pop f.. Read more ,Newly Built,2 beds0 baths0 Toilets
"Royal Garden Estate, Off Lekki Epe Expressway Ajah Lagos","9,000,000/year","  Updated 20 Jan 2023, Added 30 Dec 2022 "," FOR RENT: Well built, finished and furnished house for rent. Property is situated in the a.. Read more ",Furnished,5 beds6 baths6 Toilets
Ikota Gra Lekki Lagos,"4,500,000/year","  Updated 20 Jan 2023, Added 01 Jan 2023 ", FOR RENT: A beautiful and serviced 4 bedroom semi detached duplex in a secured estate with.. Read more ,Newly Built,4 beds4 baths5 Toilets
Osapa London Lekki Lagos,"1,600,000/year","  Updated 20 Jan 2023, Added 14 Nov 2022 ", FOR RENT: *Standard Rooms and Mini Flat In A Shared Apartment are Now Available in Osapa L.. Read more ,,0 beds0 baths0 Toilets
Chevron Lekki Lagos,"4,000,000/year","  Updated 20 Jan 2023, Added 05 Oct 2022 ", FOR RENT: 3 Years Minimum Required Agency fee: 10% Legal fee: 10% F.. Read more ,,0 beds0 baths0 Toilets
"Abiodun Jagun Street, Ogba Lagos","9,000,000/year","  Updated 20 Jan 2023, Added 19 Dec 2022 "," FOR RENT: A shop space located In a newly built Ogba Shopping Mall, by Sunday market, Ogba.. Read more ",,0 beds0 baths0 Toilets
Opebi Ikeja Lagos,"6,500,000/year","  Updated 20 Jan 2023, Added 30 Jul 2022 "," FOR RENT: A well-serviced 90-square meters showroom on the ground floor at pentagon plaza,.. Read more ",Serviced, beds baths1 Toilets
"Location:off Ligali Ayorinde, Victoria Island Lagos","13,000,000/year","  Updated 20 Jan 2023, Added 26 Dec 2022 ", FOR RENT: *FOR LEASE Semi-Brief *4 bedroom Detached building with 2 rooms guest Loca.. Read more ,,4 beds0 baths0 Toilets
Vgc Lekki Lagos,"4,500,000/year","  Updated 20 Jan 2023, Added 13 Jan 2023 ", FOR RENT: Rent: 4.5m per annum Other charges: - Agency 10% - Legal. 10% - Caution 22.. Read more ,,4 beds0 baths0 Toilets
Ikate Lekki Lagos,"3,500,000/year","  Updated 20 Jan 2023, Added 13 Jan 2023 ", FOR RENT: RENT: N3.5M SC:1M LEGAL: 10% AGENCY: 10% CAUTION : 250k.. Read more ,,2 beds0 baths0 Toilets
Victoria Island Lagos,"50,000,000/year","  Updated 20 Jan 2023, Added 20 Dec 2022 ", FOR RENT: House for rent Victoria Island Lagos.. Read more ,,0 beds0 baths0 Toilets
Old Ikoyi Ikoyi Lagos,"7,000,000/year","  Updated 20 Jan 2023, Added 28 Dec 2022 "," FOR RENT: Well-finished 4-bedroom ensuite terrace duplex with BQ pool 24hrs power, water t.. Read more ",Serviced,4 beds0 baths0 Toilets
Awolowo Road Ikoyi Lagos,"50,000,000/year","  Updated 20 Jan 2023, Added 29 Dec 2022 ", FOR RENT: LONG LEASE!!! WATERFRONT LAND FOR LEASE ON AWOLOWO ROAD IKOYI WATERFRONT L.. Read more ,,0 beds0 baths0 Toilets
Victoria Island Lagos,450/sqm,"  Updated 20 Jan 2023, Added 12 Oct 2022 "," FOR RENT: corporate office spaces available for Lease Location - Victoria island , Lago.. Read more ",,0 beds0 baths0 Toilets
Osapa London Lekki Lagos,"7,500,000/year","  Updated 20 Jan 2023, Added 07 Jan 2023 "," FOR RENT: 4 bedroom semi-detached duplex For Rent Features: All rooms en-suite, pop .. Read more ",Newly Built,4 beds4 baths5 Toilets
Mobolaji Bank Anthony Way Ikeja Lagos,"40,000,000/year","  Updated 20 Jan 2023, Added 12 Jan 2023 ", FOR RENT: An office building measuring 529sqm on 2700 sqm for lease Location: Mobolaji Ba.. Read more ,,0 beds0 baths0 Toilets
Located At Hopeville Estate Sangotedo Ajah Lagos,"1,250,000/year","  Updated 20 Jan 2023, Added 20 Jun 2022 ", FOR RENT: THEY ARE GOING FAST. WE ARE DOWN TO THE LAST THREE APARTMENTS. SO ACT FAST! V.. Read more ,,0 beds0 baths0 Toilets
Anthony Village Maryland Lagos,"12,000,000/year","  Updated 20 Jan 2023, Added 07 Sep 2022 "," FOR RENT: For Lease ------------ Open plan building at anthony village Lagos on 1,200sqm.. Read more ",, beds baths Toilets
Off Burdillion Road Ikoyi Lagos,"5,000,000,000","  Updated 18 Feb 2023, Added 13 Nov 2022 ", FOR SALE: FOR SALE!!! 27UNITS OF 3BEDROOM FLATS!!! .. Read more,Newly Built,3 beds4 baths4 Toilets
Oniru Victoria Island Lagos,"5,000,000/year","  Updated 20 Jan 2023, Added 09 Jan 2023 ", FOR RENT: Fully Serviced 2 bedroom flat for rent Rent: N5 million Service charge: N1.. Read more ,,2 beds0 baths0 Toilets
Opebi Ikeja Lagos,"9,000,000/year","  Updated 20 Jan 2023, Added 07 Jan 2023 "," FOR RENT: 90 SUARE METERS SHOW ROOM ON THE GROUND FLOOR AT PENTAGON PLAZA, OPEBI, LAGOS... Read more ",Serviced,0 beds0 baths Toilets
Ikota Lekki Lagos,"2,400,000/year","  Updated 20 Jan 2023, Added 12 Aug 2022 "," FOR RENT: 2 Bedroom Duplex For Rent Price: 2,400,000 Caution: 240,000 Agency: 240,000.. Read more ",Newly Built,0 beds0 baths0 Toilets
Mojisola Onikoyi Estate Ikoyi Lagos,"8,000,000/year","  Updated 20 Jan 2023, Added 03 Jan 2023 "," FOR RENT: *TO LET ON BANANA ISLAND ROAD, IKOYI LAGOS SERVICED 4 BEDROOM TERRACED HOUSE .. Read more ",Serviced,4 beds4 baths5 Toilets
Peninsula Estate By Blenco Sangotedo Sangotedo Lagos,"2,500,000/year","  Updated 20 Jan 2023, Added 13 Dec 2022 ", FOR RENT: A renovated 4 bedroom terrace duplex is available for rent in a secured estate (.. Read more ,,4 beds4 baths5 Toilets
Unity Homes Estate Thomas Estate Ajah Lagos,"3,500,000/year","  Updated 20 Jan 2023, Added 09 Jan 2023 ", FOR RENT: brand new detached duplex 4bedroom for rent in unity homes Thomas estate Rent .. Read more ,Newly Built,4 beds4 baths5 Toilets
Off Durosinmi Eti Drive Lekki Phase 1 Lekki Lagos,"4,000,000/year","  Updated 20 Jan 2023, Added 05 Sep 2022 ", FOR RENT: 4 ROOMS OFFICE SPACE (TOP FLOOR) QUIET AND COOPERATIVE OFFICE PREFERRED LOC.. Read more ,,0 beds0 baths0 Toilets
Lekki Phase 1 Lekki Lagos,"10,000,000/year","  Updated 20 Jan 2023, Added 22 Dec 2022 ", FOR RENT: Extremely spacious 5 bedroom semi detached duplex with Bq off admiralty way lekk.. Read more ,,5 beds0 baths0 Toilets
Banana Island Ikoyi Lagos,"15,000,000/year","  Updated 20 Jan 2023, Added 12 Dec 2022 ", FOR RENT: Fully furnished 3-bedroom apartment in Banana Island serviced with a swimming.. Read more ,Serviced,3 beds3 baths4 Toilets
Off Ligali Ayorinde Victoria Island Lagos,"18,000,000/year","  Updated 20 Jan 2023, Added 26 Dec 2022 ", FOR RENT: Description: 5 bedroom detached duplex with 2 Rooms boys quarter. Location: o.. Read more ,,5 beds0 baths0 Toilets
Ogudu Lagos,"1,500,000/year","  Updated 20 Jan 2023, Added 28 Dec 2022 ", FOR RENT: Spacious and decent 3 bedroom in Alhaja eleshi with all rooms ensuit guest toile.. Read more ,,3 beds3 baths4 Toilets
Nicon Town Lekki Lagos,"800,000/year","  Updated 20 Jan 2023, Added 02 Dec 2022 ", FOR RENT: Self Serviced studio apartment upstairs inside a secured estate Rent: N800k .. Read more ,,0 beds0 baths0 Toilets
Kirikiri Apapa Lagos,"12,000,000/year","  Updated 20 Jan 2023, Added 23 Nov 2022 ", FOR RENT: Commercial Property for rent Kirikiri Apapa Lagos.. Read more ,, beds1 baths1 Toilets
Lekki Phase 1 Lekki Lagos,"8,500,000/year","  Updated 20 Jan 2023, Added 19 Dec 2022 ", FOR RENT: FOR LEASE: Fully Detached 4 Bedroom Fully Detached Duplex suitable for office an.. Read more ,,4 beds0 baths0 Toilets
Ogudu Orike Ogudu Lagos,"1,800,000/year","  Updated 20 Jan 2023, Added 09 Dec 2022 ", FOR RENT: Land for lease at ogudu bustop by traffic light 1.8m per annum .. Read more ,,0 beds0 baths0 Toilets
Alara Street Onike Yaba Lagos,"2,500,000/year","  Updated 20 Jan 2023, Added 06 Jan 2023 ", FOR RENT: A lovely and nice well finished 3bedroom flat in onike yaba in alara street with.. Read more ,,3 beds3 baths4 Toilets
Lekki Phase 1 Lekki Lagos,"10,000,000/year","  Updated 20 Jan 2023, Added 07 Jan 2023 ", FOR RENT: Strictly office space 4-bedroom fully detached duplex is available To-Let Off .. Read more ,,4 beds0 baths0 Toilets
Lekki Phase 1 Lekki Lagos,"4,000,000/year","  Updated 20 Jan 2023, Added 13 Dec 2022 "," FOR RENT: 3 bedroom flat All rooms ensuite Guest restroom Rent: 4,000,000 Refundable C.. Read more ",,3 beds3 baths4 Toilets
Igbo Efon Lekki Lagos,"2,300,000/year","  Updated 20 Jan 2023, Added 30 Dec 2022 "," FOR RENT: Size of unit - 2BR duplex Location: Igboefon, Lekki. Rent = 2,300,000 (Tw.. Read more ",,2 beds2 baths3 Toilets
Lekki Phase One Lekki Phase 1 Lekki Lagos,"30,000,000/year","  Updated 20 Jan 2023, Added 06 Dec 2022 ", FOR RENT: Land for rent Lekki Phase One Lekki Phase 1 Lekki Lagos.. Read more ,,0 beds0 baths0 Toilets
Osapa London Off Agungi Lekki Lagos,"102,000,000","  Updated 19 Feb 2023, Added 12 Jan 2023 ", FOR SALE: Newly Built 4bedroom semi-detached duplex with a bq Location: Osapa London o.. Read more,Newly Built,4 beds4 baths5 Toilets
Banana Island Ikoyi Lagos,"15,000,000/year","  Updated 20 Jan 2023, Added 15 Dec 2022 "," FOR RENT: Spacious 4 Bedroom terrace with a bq . Location- Banana Island, Ikoyi. Rent:.. Read more ",Serviced,4 beds4 baths5 Toilets
Obanikoro Estate Obanikoro Shomolu Lagos,"2,000,000/year","  Updated 20 Jan 2023, Added 06 Jan 2023 ", FOR RENT: A lovely and nice well-finished 2bedroom flat in obanikoro estate with all round.. Read more ,Serviced,2 beds2 baths3 Toilets
Atunrase Medina Gbagada Lagos,"1,300,000/year","  Updated 20 Jan 2023, Added 30 Dec 2022 ", FOR RENT: Decent 2 bedrooms up flat both room ensuite with guest toilet all tilled POP Kit.. Read more ,,2 beds2 baths3 Toilets
Victoria Island Lagos,"6,000,000/year","  Updated 20 Jan 2023, Added 16 Dec 2022 ", FOR RENT: 3-BEDROOM FLAT WITH A ROOM BQ COMES WITH A COMMUNAL GYM AND POOL LOCATION: V.. Read more ,Serviced,3 beds3 baths4 Toilets
Victoria Island Lagos,"30,000,000/year","  Updated 20 Jan 2023, Added 26 Dec 2022 "," FOR RENT: For Lease A detached house Victoria island Land Size:-1,100sq mtr. Price:-#.. Read more ",,0 beds0 baths0 Toilets
Lekki Phase 1 Lekki Lagos,"2,200,000/year","  Updated 20 Jan 2023, Added 07 Dec 2022 ", FOR RENT: Land for rent Lekki Phase 1 Lekki Lagos.. Read more ,,0 beds0 baths0 Toilets
Iju Ishaga Agege Lagos,"1,500,000/year","  Updated 20 Jan 2023, Added 15 Jan 2023 ", FOR RENT: *LETTING *3 BEDROOM *@ KAY FARM ESTATE New lovely 3-bedroom flat at Kay f.. Read more ,,0 beds0 baths0 Toilets
Idado Lekki Lagos,"3,000,000/year","  Updated 20 Jan 2023, Added 13 Jan 2023 ", FOR RENT: RENT: N3M SC: N1.8M (covers diesel for 12 hours daily) LEGAL: 5% AGENCY: 10% .. Read more ,,3 beds0 baths0 Toilets
Opebi Ikeja Lagos,"1,800,000/year","  Updated 20 Jan 2023, Added 13 Sep 2022 ", FOR RENT: A well serviced 60 square meters office space on the third floor at Pentagon Pla.. Read more ,Serviced, beds baths1 Toilets
God Vineyard Estate Badore Ajah Lagos,"1,700,000/year","  Updated 20 Jan 2023, Added 05 Dec 2022 "," FOR RENT: ABOVE IS 6BED ROOM DUPLEX AT GOD VINEYARD ESTATE AT BADORE ROAD, RENT 1.7M, AGEN.. Read more ",,0 beds6 baths6 Toilets
Lekki Phase 1 Lekki Lagos,"5,000,000/year","  Updated 20 Jan 2023, Added 22 Sep 2022 ", FOR RENT: Commercial Property for rent Lekki Phase 1 Lekki Lagos.. Read more ,,0 beds0 baths0 Toilets
Victoria Island Lagos,"85,000/sqm","  Updated 20 Jan 2023, Added 19 Dec 2022 ", FOR RENT: TO LET – VICTORIA ISLAND Superlative corporate office for a multinational co.. Read more ,, beds baths Toilets
Banana Island Ikoyi Lagos,"30,000,000/year","  Updated 20 Jan 2023, Added 19 Dec 2022 ", FOR RENT: 4 BEDROOM LUXURY DETACHED HOUSE with Luxury finishing . Features!!! -All Roo.. Read more ,Serviced,4 beds4 baths5 Toilets
Orchid Lagos Island Lagos Island Lagos,"5,000,000/year","  Updated 20 Jan 2023, Added 16 Dec 2022 ", FOR RENT: Serviced Four Bedroom Terrace Duplex for Rent Location: Orchid behind Dreamw.. Read more ,ServicedNewly Built,4 beds4 baths4 Toilets
Oniru Victoria Island Lagos,"10,000,000/year","  Updated 20 Jan 2023, Added 13 Jan 2023 "," FOR RENT: Rent: 10m, per annum Other charges: - Agency 10% - Legal. 10% - Caution 50.. Read more ",,4 beds0 baths0 Toilets
Shogunle Oshodi Lagos,"10,000,000/year","  Updated 20 Jan 2023, Added 23 Dec 2022 ", FOR RENT: 4 bedroom duplex with 2 units of three bedroom apartments to be let to one tenan.. Read more ,Newly Built,0 beds0 baths0 Toilets
Off College Rd Ogba Lagos. Ogba Lagos,"1,200,000/year","  Updated 20 Jan 2023, Added 17 Jan 2023 "," FOR RENT: Brand new 2 bedroom, pop, ENSUITE @ off college rd OGBA Lagos... Read more ",,0 beds0 baths0 Toilets
Ikoyi Lagos,"10,000,000/year","  Updated 20 Jan 2023, Added 16 Nov 2022 ", FOR RENT: LUXURIOUSLY BUILT 4 BEDROOM MAISONETTE Other charges: - Agency: 10% - Legal.. Read more ,,0 beds0 baths0 Toilets
Lekky County Ikota Lekki Lagos,"3,500,000/year","  Updated 20 Jan 2023, Added 12 Dec 2022 ", FOR RENT: LOVELY 4-BEDROOM TERRACE DUPLEX WITH A BQ FOR RENT AN EAGLES VIEW RENT: N3.5M.. Read more ,,4 beds0 baths0 Toilets
Aerodrome Gra Samonda Ibadan Oyo,"135,000,000","  Updated 18 Feb 2023, Added 15 Feb 2023 "," FOR SALE: 4 BEDROOM SEMI DETACHED DUPLEX, swimming pool WITH TWO UNITS OF RØOM AND A PARLO.. Read more",Newly BuiltFurnished,4 beds4 baths4 Toilets
Ikota Gra Ikota Lekki Lagos,"4,000,000/year","  Updated 20 Jan 2023, Added 14 Dec 2022 ", FOR RENT: 4 BEDROOM DUPLEX IN IKOTA GRA FOR RENT RENT: 4M SC: 38K (MONTHLY) LEGAL: 10.. Read more ,,4 beds0 baths0 Toilets
Romax Estate By Vgc Vgc Lekki Lagos,"4,000,000/year","  Updated 20 Jan 2023, Added 12 Dec 2022 ", FOR RENT: A brand new serviced 4 bedroom semi detached duplex with bq Available for rent i.. Read more ,ServicedNewly Built,4 beds4 baths5 Toilets
Adeola Odeku Victoria Island Lagos,450/sqm,"  Updated 20 Jan 2023, Added 31 Oct 2022 ", FOR RENT: Commercial Rental!! Premium Open Plan Office Spaces situated along Adeola Odeku.. Read more ,,0 beds0 baths0 Toilets
Adeniyi Jones Ikeja Lagos,"8,000,000/year","  Updated 20 Jan 2023, Added 31 Dec 2022 ", FOR RENT: A conducive 4 bedroom wing of duplex plus 2bedroom boys quarters on a serene env.. Read more ,,4 beds4 baths5 Toilets
Off Admiralty Way Lekki Phase 1 Lekki Lagos,"4,500,000/year","  Updated 20 Jan 2023, Added 05 Sep 2022 ", FOR RENT: Open Plan Office Space in the heart Of Lekki Measuring 250 SQM for Rent Lo.. Read more ,Serviced, beds baths Toilets
Ikota Lekki Lagos,"4,000,000/year","  Updated 20 Jan 2023, Added 18 Dec 2022 ", FOR RENT: Other Charges : Agency 10% Legal 10% Caution: 250k Service Charge: 600k pe.. Read more ,,4 beds0 baths0 Toilets
Orchid Lekki Lagos,"4,000,000/year","  Updated 20 Jan 2023, Added 19 Dec 2022 ", FOR RENT: RENT: 4M SC: 40K MONTHLY LEGAL: 10% AGENCY: 10% CAUTION: 10% TOTAL PACKAG.. Read more ,,4 beds0 baths0 Toilets
In A Mini Court Ologolo Lekki Lagos,"4,000,000/year","  Updated 20 Jan 2023, Added 19 Dec 2022 ", FOR RENT: Brand New 4bedroom duplex with spacious rooms and fitted kitchen in a well secur.. Read more ,ServicedNewly Built,4 beds4 baths5 Toilets
Olowora Ojodu Lagos,"1,000,000/year","  Updated 20 Jan 2023, Added 11 Jan 2023 ", FOR RENT: Brand New Mini flat at olowora on a tarred road. Very nice Rent 1million other c.. Read more ,Newly Built,1 beds2 baths2 Toilets
Oworonshoki Gbagada Lagos,"1,000,000/year","  Updated 20 Jan 2023, Added 12 Jan 2023 ", FOR RENT: 2 bedroom duplex for rent in oworo 1m per annum.. Read more ,,2 beds3 baths3 Toilets
Lekki Phase 1 Lekki Lagos,"8,000,000/year","  Updated 20 Jan 2023, Added 25 Dec 2022 ", FOR RENT: SHOP SPACE AVAILABLE FOR RENT Location : LEKKI PHASE 1 LAGOS Price 47sqm .. Read more ,,0 beds0 baths0 Toilets
"Adjacent Crown Estate, Sangotedo Crown Estate Ajah Lagos","3,000,000/year","  Updated 20 Jan 2023, Added 15 Sep 2022 ", FOR RENT: To let...... Newly Built 4 Bedroom Terrace Duplex (Smart Home)at Vintage Estate.. Read more ,, beds baths Toilets
Ikoyi Lagos,"50,000,000/year","  Updated 20 Jan 2023, Added 17 Dec 2022 ", FOR RENT: Agency fee: 10% Legal fee: 10% Evergreen .. Read more ,,0 beds0 baths0 Toilets
Osapa London Lekki Lagos,"5,000,000/year","  Updated 20 Jan 2023, Added 27 Jul 2022 "," FOR RENT: 4 Bedroom Semi Detached Duplex For Rent Price: N5,000,000 Features: -All R.. Read more ",,0 beds0 baths0 Toilets
Soluyi Gbagada Lagos,"2,700,000/year","  Updated 20 Jan 2023, Added 29 Dec 2022 ", FOR RENT: *Christmas reduction Newly built n Spacious 3 bedrooms up flat with all rooms.. Read more ,Newly Built,3 beds3 baths3 Toilets
Adjacent Crown Estate Sangotedo Crown Estate Ajah Lagos,"2,150,000/year","  Updated 20 Jan 2023, Added 15 Sep 2022 "," FOR RENT: To let...... Newly Built 4 Bedroom Terrace Duplex at Vintage Estate, opposite C.. Read more ",,0 beds0 baths0 Toilets
Ikate Lekki Lagos,"7,000,000/year","  Updated 20 Jan 2023, Added 17 Dec 2022 ", FOR RENT: 4 Bedroom Semi Detached Duplex with BQ for Rent! Rent: N7 Million Other ch.. Read more ,,4 beds0 baths0 Toilets
Curtis Jones Street Adeniran Ogunsanya Surulere Lagos,"5,000,000/year","  Updated 20 Jan 2023, Added 14 Jan 2023 ", FOR RENT: A lovely and nice newly renovated 4bedroom duplex in surulere off adeniran oguns.. Read more ,,4 beds4 baths5 Toilets
Channels Tv Road Isheri North Ojodu Lagos,"1,000,000/year","  Updated 20 Jan 2023, Added 21 Dec 2022 ", FOR RENT: Excellent security surveillance Good for office use or store Accessible to lin.. Read more ,,0 beds0 baths0 Toilets
Alagomeji Yaba Lagos,"2,780,000/year","  Updated 20 Jan 2023, Added 18 Dec 2022 "," FOR RENT: An office space around alagomeji 135sqmt open space, serviced. #20k per sqmt, se.. Read more ",Serviced,0 beds0 baths0 Toilets
Lekki County Homes Ikota Lekki Lagos,"220,000,000","  Updated 19 Feb 2023, Added 14 Dec 2022 "," FOR SALE: 5 BEDROOM FULLY DETACHED HOME FOR SALE!!! Location: Lekki County, Lagos Fe.. Read more",Newly Built,5 beds5 baths5 Toilets
Ogudu Road Ogudu Ogudu Lagos,"4,000,000/year","  Updated 20 Jan 2023, Added 01 Jul 2022 ", FOR RENT: shop space available now in alpha mall 117 ogudu Road Gra Lagos First floor f.. Read more ,,0 beds0 baths0 Toilets
Off Admiralty Way Lekki Phase 1 Lekki Lagos,"30,000,000/year","  Updated 20 Jan 2023, Added 07 Dec 2022 ", FOR RENT: Minimum of 5 years up-front lease payment is required . It is very suitable for .. Read more ,,0 beds0 baths0 Toilets
Chevy View Chevron Lekki Lagos,"5,500,000/year","  Updated 20 Jan 2023, Added 13 Dec 2022 ", FOR RENT: 4 bedroom House for rent Chevy View chevron Lekki Lagos.. Read more ,ServicedNewly Built,4 beds5 baths5 Toilets
Lekki Phase 1 Lekki Lagos,"5,500,000/year","  Updated 20 Jan 2023, Added 09 Jan 2023 ", FOR RENT: 3-bedroom flat with bq in lekki phase 1. Rent: N5.5m Service charges: N1.5m.. Read more ,,3 beds3 baths4 Toilets
Ikate Elegushi Lekki Ikate Lekki Lagos,"6,000,000/year","  Updated 20 Jan 2023, Added 03 Jan 2023 ", FOR RENT: FOR SALE & FOR RENT DIRECT BRIEF Well maintained 4 bedroom terrace.contem.. Read more ,Serviced,4 beds4 baths5 Toilets
Oniru Victoria Island Lagos,"10,000,000/year","  Updated 20 Jan 2023, Added 13 Jan 2023 ", FOR RENT: Rental price : 10M / Annum Other charges: - Agency: 10% - Legal: 10% - .. Read more ,,4 beds0 baths0 Toilets
Chevron Lekki Lagos,"1,200,000/year","  Updated 20 Jan 2023, Added 24 Nov 2022 ", FOR RENT: • Semi Masters Bedroom in a Shared Apartment Rent: N1.2 Million Features:.. Read more ,,0 beds0 baths0 Toilets
"Buenavista Estate,by Ochid Road Through Second Toll Gate Chevron Lekki Lagos","4,000,000/year","  Updated 20 Jan 2023, Added 27 Dec 2022 ", FOR RENT: An Exquisite 4 Bedroom Semi- Detached Duplex (Spacious) Rent: N4 Million Age.. Read more ,,4 beds4 baths5 Toilets
Banana Island Ikoyi Lagos,"15,000,000/year","  Updated 20 Jan 2023, Added 18 Dec 2022 ", FOR RENT: BANANA ISLAND 4-BEDROOM TERRACE DUPLEX DESCRIPTION; Exquisite and spacio.. Read more ,ServicedNewly Built,4 beds4 baths5 Toilets
Olaleye New Town Estate Iponri Surulere Lagos,"3,000,000/year","  Updated 20 Jan 2023, Added 14 Jan 2023 ", FOR RENT: A lovely and nice well finished newly built 3bedroom Maisonnett duplex with a ro.. Read more ,Newly Built,3 beds3 baths4 Toilets
Eric Moore Eric Moore Surulere Lagos,"1,500/sqm","  Updated 20 Jan 2023, Added 13 Dec 2022 ", FOR RENT: Commercial Property for rent Eric Moore Eric moore Surulere Lagos.. Read more ,,0 beds0 baths0 Toilets
Ilaje Ajah Lagos,"1,300,000/year","  Updated 20 Jan 2023, Added 12 Jan 2023 ", FOR RENT: WhatsApp.. Read more ,Serviced,2 beds2 baths3 Toilets
Estate Anthony Village Maryland Lagos,"1,300,000/year","  Updated 20 Jan 2023, Added 30 Dec 2022 ", FOR RENT: This is a clean 2bed in Anthony in a secured estate. Price is 1.3m other charges.. Read more ,,2 beds2 baths2 Toilets
